"","id","pubdate","firstauthor","lastauthor","source","title","year"
"1","12171729","2001","Gennery AR","Abinun M","Cytotherapy","CAMPATH-1M T-cell depleted BMT for SCID: long-term follow-up of 19 children treated 1987-98 in a single center.","2001"
"2","12171727","2001","Lush RJ","Russell NH","Cytotherapy","Allogeneic stem-cell transplantation for lymphoproliferative disorders using BEAM-CAMPATH (+/- fludarabine) conditioning combined with post-transplant donor-lymphocyte infusion.","2001"
"3","12171726","2001","Kottaridis PD","MacKinnon S","Cytotherapy","In vivo CAMPATH-1H prevents GvHD following nonmyeloablative stem-cell transplantation.","2001"
"4","12171723","2001","Novitzky N","Rouskova A","Cytotherapy","Infectious complications following T-cell depleted hematopoietic stem-cell transplantation.","2001"
"5","12171714","2001","Rebello P","Hale G","Cytotherapy","Pharmacokinetics of CAMPATH-1H in BMT patients.","2001"
"6","11342359","2001 Mar","Khorana A","Czuczman MS","Leukemia &amp; lymphoma","A phase II multicenter study of CAMPATH-1H antibody in previously treated patients with nonbulky non-Hodgkin's lymphoma.","2001"
"7","11001893","2000 Oct 1","Kottaridis PD","Mackinnon S","Blood","In vivo CAMPATH-1H prevents graft-versus-host disease following nonmyeloablative stem cell transplantation.","2000"
"8","10773997","2000 Mar","Calne R","Waldmann H","Nihon Geka Gakkai zasshi","Prope tolerance with induction using Campath 1H and low-dose cyclosporin monotherapy in 31 cadaveric renal allograft recipients.","2000"
"9","10589966","1999 Nov 27","Calne R","Waldmann H","Transplantation","Campath IH allows low-dose cyclosporine monotherapy in 31 cadaveric renal allograft recipients.","1999"
"10","10568572","1999 Nov 13","Coles AJ","Compston A","Lancet (London, England)","Pulsed monoclonal antibody treatment and autoimmune thyroid disease in multiple sclerosis.","1999"
"11","10482259","1999 Sep","Coles AJ","Compston A","Annals of neurology","Monoclonal antibody treatment exposes three mechanisms underlying the clinical course of multiple sclerosis.","1999"
"12","10417050","1999 Jun","Wiesneth M","Kubanek B","Journal of hematotherapy","Comparison of T-cell-depleted BMT and PBPCT with respect to chimerism, graft rejection, and leukemic relapse.","1999"
"13","10390197","1999 Jul","Naparstek E","Slavin S","Experimental hematology","Engraftment of marrow allografts treated with Campath-1 monoclonal antibodies.","1999"
"14","10350345","1999 Jun","Thornton PD","Catovsky D","Leukemia &amp; lymphoma","High dose methyl prednisolone in refractory chronic lymphocytic leukaemia.","1999"
"15","9845524","1998 Dec 15","Hale G","Waldmann H","Blood","Improving the outcome of bone marrow transplantation by using CD52 monoclonal antibodies to prevent graft-versus-host disease and graft rejection.","1998"
"16","9779699","1998 Oct","Lundin J","Mellstedt H","Journal of clinical oncology : official journal of the American Society of Clinical Oncology","CAMPATH-1H monoclonal antibody in therapy for previously treated low-grade non-Hodgkin's lymphomas: a phase II multicenter study. European Study Group of CAMPATH-1H Treatment in Low-Grade Non-Hodgkin's Lymphoma.","1998"
"17","9502298","1997 Dec","Walters MC","Sullivan KM","Biology of blood and marrow transplantation : journal of the American Society for Blood and Marrow Transplantation","Collaborative multicenter investigation of marrow transplantation for sickle cell disease: current results and future directions.","1997"
"18","9235735","1997 Jul 7","de Nully Brown P","Nissen NI","Ugeskrift for laeger","[Campath-1H--a monoclonal antibody for treatment of non-Hodgkin's and chronic lymphatic leukemia].","1997"
"19","9215839","1997 Jul","Pawson R","Catovsky D","Journal of clinical oncology : official journal of the American Society of Clinical Oncology","Treatment of T-cell prolymphocytic leukemia with human CD52 antibody.","1997"
"20","9195505","1997 Jun","Schnitzer TJ","Johnston JM","The Journal of rheumatology","Subcutaneous administration of CAMPATH-1H: clinical and biological outcomes.","1997"
"21","9250818","1997 May","Mehta J","Singhal S","Leukemia &amp; lymphoma","Autologous transplantation with CD52 monoclonal antibody-purged marrow for acute lymphoblastic leukemia: long-term follow-up.","1997"
"22","9193354","1997 Apr","Osterborg A","Mellstedt H","Journal of clinical oncology : official journal of the American Society of Clinical Oncology","Phase II multicenter study of human CD52 antibody in previously treated chronic lymphocytic leukemia. European Study Group of CAMPATH-1H Treatment in Chronic Lymphocytic Leukemia.","1997"
"23","9049965","1996 Dec","Tang SC","Berinstein NL","Leukemia &amp; lymphoma","Immunosuppressive toxicity of CAMPATH1H monoclonal antibody in the treatment of patients with recurrent low grade lymphoma.","1996"
"24","8707338","1996 May","Brett S","Rapson N","Immunology","Repopulation of blood lymphocyte sub-populations in rheumatoid arthritis patients treated with the depleting humanized monoclonal antibody, CAMPATH-1H.","1996"
"25","8611450","1996 Apr","Osterborg A","Mellstedt H","British journal of haematology","Humanized CD52 monoclonal antibody Campath-1H as first-line treatment in chronic lymphocytic leukaemia.","1996"
"26","8722340","1996 Mar","Ringdén O","Pamphilon DH","Bone marrow transplantation","Transplantation of peripheral blood progenitor cells from unrelated donors.","1996"
"27","8671618","1996 Mar","Brett SJ","Rapson N","International immunology","Emergence of CD52-, glycosylphosphatidylinositol-anchor-deficient lymphocytes in rheumatoid arthritis patients following Campath-1H treatment.","1996"
"28","7488279","1995 Nov","Weinblatt ME","Manna VK","Arthritis and rheumatism","CAMPATH-1H, a humanized monoclonal antibody, in refractory rheumatoid arthritis. An intravenous dose-escalation study.","1995"
"29","7575719","1995 Sep","Jendro MC","Goronzy JJ","Arthritis and rheumatism","Emergence of oligoclonal T cell populations following therapeutic T cell depletion in rheumatoid arthritis.","1995"
"30","7575711","1995 Sep","Matteson EL","Johnston JM","Arthritis and rheumatism","Treatment of active refractory rheumatoid arthritis with humanized monoclonal antibody CAMPATH-1H administered by daily subcutaneous injection.","1995"
"31","7632956","1995 Aug 15","Hertenstein B","Schrezenmeier H","Blood","Emergence of CD52-, phosphatidylinositolglycan-anchor-deficient T lymphocytes after in vivo application of Campath-1H for refractory B-cell non-Hodgkin lymphoma.","1995"
"32","7655382","1995 Apr","Bunjes D","Heimpel H","Bone marrow transplantation","In vivo/ex vivo T cell depletion reduces the morbidity of allogeneic bone marrow transplantation in patients with acute leukaemias in first remission without increasing the risk of treatment failure: comparison with cyclosporin/methotrexate.","1995"
"33","7531440","1995 Feb","Ruderman EM","Gravallese EM","Arthritis and rheumatism","Synovial tissue response to treatment with Campath-1H.","1995"
"34","7920312","1994 Jun","Jacobs P","Hale G","Bone marrow transplantation","T cell depletion by exposure to Campath-1G in vitro prevents graft-versus-host disease.","1994"
"35","7922004","1994 Spring","Hale G","Waldmann H","Journal of hematotherapy","CAMPATH-1 monoclonal antibodies in bone marrow transplantation.","1994"
"36","8324942","1993 Mar-Apr","Watts RA","Waldmann H","Clinical and experimental rheumatology","CAMPATH-1H in inflammatory arthritis.","1993"
"37","1391938","1992 Oct 1","Naparstek E","Slavin S","Blood","Enhanced marrow recovery by short preincubation of marrow allografts with human recombinant interleukin-3 and granulocyte-macrophage colony-stimulating factor.","1992"
"38","1356177","1992 Sep 26","Isaacs JD","Waldmann H","Lancet (London, England)","Humanised monoclonal antibody therapy for rheumatoid arthritis.","1992"
"39","2667209","1989 Aug","Friend PJ","Calne RY","Transplantation","Campath-1M--prophylactic use after kidney transplantation. A randomized controlled clinical trial.","1989"
"40","2480280","1989","Kolb HJ","Wilmanns W","Folia haematologica (Leipzig, Germany : 1928)","Bone marrow transplantation for the treatment of leukaemia-results of the Munich Cooperative Group.","1989"
"41","3106970","1987 May","Liu AY","Hellström I","Proceedings of the National Academy of Sciences of the United States of America","Chimeric mouse-human IgG1 antibody that can mediate lysis of cancer cells.","1987"
"42","3260935","1988 Jul 1","Bindon CI","Waldmann H","The Journal of experimental medicine","Human monoclonal IgG isotypes differ in complement activating function at the level of C4 as well as C1q.","1988"
"43","3584980","1987 Jun 15","Shaw DR","LoBuglio AF","Journal of immunology (Baltimore, Md. : 1950)","Characterization of a mouse/human chimeric monoclonal antibody (17-1A) to a colon cancer tumor-associated antigen.","1987"
"44","3138110","1988 Jul","Dangl JL","Oi VT","The EMBO journal","Segmental flexibility and complement fixation of genetically engineered chimeric human, rabbit and mouse antibodies.","1988"
"45","3096824","1986 Jul-Aug","Bandini G","Tura S","Haematologica","T-cell depletion with the monoclonal antibody Campath 1 to prevent graft-versus-host disease in ten high-risk adult patients.","1986"
"46","3529531","1986 Sep","Hale G","Calne R","Transplantation","Pilot study of CAMPATH-1, a rat monoclonal antibody that fixes human complement, as an immunosuppressant in organ transplantation.","1986"
"47","6438435","1983 Oct","Hale G","Waldmann H","Molecular biology &amp; medicine","Effects of monoclonal anti-lymphocyte antibodies in vivo in monkeys and humans.","1983"
"48","2904526","1988 Dec 17","Hale G","Waldmann H","Lancet (London, England)","Remission induction in non-Hodgkin lymphoma with reshaped human monoclonal antibody CAMPATH-1H.","1988"
"49","6349718","1983 Oct","Hale G","Waldmann H","Blood","Removal of T cells from bone marrow for transplantation: a monoclonal antilymphocyte antibody that fixes human complement.","1983"
"50","3980990","1985 May","Hale G","Waldmann H","Journal of immunology (Baltimore, Md. : 1950)","Therapeutic potential of rat monoclonal antibodies: isotype specificity of antibody-dependent cell-mediated cytotoxicity with human lymphocytes.","1985"
"51","6390085","1983 Oct","Hale G","Waldmann H","Molecular biology &amp; medicine","Removal of T cells from bone marrow for transplantation. Comparison of rat monoclonal anti-lymphocyte antibodies of different isotypes.","1983"
"52","3513818","1986 Mar","Morgan G","Levinsky RJ","British journal of haematology","Successful haploidentical mismatched bone marrow transplantation in severe combined immunodeficiency: T cell removal using CAMPATH-I monoclonal antibody and E-rosetting.","1986"
"53","3540463","1986","Papa G","Purpura M","Leukemia research","Standard conditioning regimen and T-depleted donor bone marrow for transplantation in chronic myeloid leukemia.","1986"
"54","3655386","1987 Oct 23","Hale G","Coombs RR","Journal of immunological methods","Isolation of low-frequency class-switch variants from rat hybrid myelomas.","1987"
"55","3332120","1986 May","Apperley JF","Gordon-Smith EC","Bone marrow transplantation","Bone marrow transplantation for patients with chronic myeloid leukaemia: T-cell depletion with Campath-1 reduces the incidence of graft-versus-host disease but may increase the risk of leukaemic relapse.","1986"
"56","3127726","1988 Mar 24","Riechmann L","Winter G","Nature","Reshaping human antibodies for therapy.","1988"
"57","3500259","1987 Nov 1","Brüggemann M","Neuberger MS","The Journal of experimental medicine","Comparison of the effector functions of human immunoglobulins using a matched set of chimeric antibodies.","1987"
"58","2451287","1988 Mar 25","Verhoeyen M","Winter G","Science (New York, N.Y.)","Reshaping human antibodies: grafting an antilysozyme activity.","1988"
"59","7879212","1995 Feb","Friend PJ","Harris DT","Transplantation proceedings","Successful treatment of renal allograft rejection with a humanized antilymphocyte monoclonal antibody.","1995"
"60","3713831","1986 May 29-Jun 4","Jones PT","Winter G","Nature","Replacing the complementarity-determining regions in a human antibody with those from a mouse.","1986"
"61","2562939","1989 Jan","Levinsky RJ","Levinsky RJ","Clinical immunology and immunopathology","Recent advances in bone marrow transplantation.","1989"
"62","3614380","1987 Aug 20-26","Roberts S","Rees AR","Nature","Generation of an antibody with enhanced affinity and specificity for its antigen by protein engineering.","1987"
"63","3528046","1986 Mar-Apr","Slavin S","Pollack A","Israel journal of medical sciences","New approaches for the prevention of rejection and graft-vs.-host disease in clinical bone marrow transplantation.","1986"
"64","3387441","1988 Jul","Steplewski Z","Koprowski H","Proceedings of the National Academy of Sciences of the United States of America","Biological activity of human-mouse IgG1, IgG2, IgG3, and IgG4 chimeric monoclonal antibodies with antitumor specificity.","1988"
"65","990273","1976 Nov 16","Schumaker VN","Müller-Eberhard HJ","Biochemistry","Ultracentifuge studies of the binding of IgG of different subclasses to the Clq subunit of the first component of complement.","1976"
"66","8652811","1996 Jun 15","Cheson BD","Rai KR","Blood","National Cancer Institute-sponsored Working Group guidelines for chronic lymphocytic leukemia: revised guidelines for diagnosis and treatment.","1996"
"67","8704678","1996 Mar","Hale G","Waldmann H","Bone marrow transplantation","Recent results using CAMPATH-1 antibodies to control GVHD and graft rejection.","1996"
"68","16160950","1999 Feb","Rioux P","Rioux P","IDrugs : the investigational drugs journal","CAMPATH-1H (Cambridge University).","1999"
"69","12171730","2001","Phillips J","Hale G","Cytotherapy","Manufacture and quality control of CAMPATH-1 antibodies for clinical trials.","2001"
"70","12171725","2001","Marsh JC","Gordon-Smith EC","Cytotherapy","CAMPATH-1H in the treatment of autoimmune cytopenias.","2001"
"71","12171722","2001","Hale G","Waldmann H","Cytotherapy","CAMPATH-1 antibodies in stem-cell transplantation.","2001"
"72","12171721","2001","Hale G","Hale G","Cytotherapy","The CD52 antigen and development of the CAMPATH antibodies.","2001"
"73","12171720","2001","Hale G","Hale G","Cytotherapy","Friends, faithfulness and fortunes.","2001"
"74","12113137","2001 Jun","Morrison VA","Morrison VA","Expert review of anticancer therapy","Update on prophylaxis and therapy of infection in patients with chronic lymphocytic leukemia.","2001"
"75","12113127","2001 Jun","","","Expert review of anticancer therapy","Berlex Laboratories to market new treatment for B-CLL.","2001"
"76","12042050","2000","Williams RJ","Pamphilon DH","Cytotherapy","Impact on T-cell depletion and CD34+ cell recovery using humanised CD52 monoclonal antibody (CAMPATH-1H) in BM and PSBC collections; comparison with CAMPATH-1M and CAMPATH-1G.","2000"
"77","11962789","2000 Jun 1-7","Norman K","Norman K","Nursing times","Behçet's syndrome. Wise after the event.","2000"
"78","11899778","2001 Mar-Apr","Sorokin P","Sorokin P","Clinical journal of oncology nursing","Campath-1H.","2001"
"79","11879313","2001 Jul-Aug","Smith JA","Smith JA","Cancer practice","Alemtuzumab: a new option for refractory chronic lymphocytic leukemia?","2001"
"80","11847424","2001","Huston JS","George AJ","Human antibodies","Engineered antibodies take center stage.","2001"
"81","11778765","2001","Pangalis GA","Siakantaris MP","Medical oncology (Northwood, London, England)","Campath-1H (anti-CD52) monoclonal antibody therapy in lymphoproliferative disorders.","2001"
"82","11722986","2001","Press OW","Timmerman J","Hematology. American Society of Hematology. Education Program","Immunotherapy of Non-Hodgkin's lymphomas.","2001"
"83","11722982","2001","Rai KR","Montserrat E","Hematology. American Society of Hematology. Education Program","Chronic lymphocytic leukemia: case-based session.","2001"
"84","11585011","2001 Jun","Illidge TM","Bayne MC","Expert opinion on pharmacotherapy","Antibody therapy of lymphoma.","2001"
"85","11583062","2001 Jul","Simpson D","Simpson D","Expert opinion on pharmacotherapy","New developments in the prophylaxis and treatment of graft versus host disease.","2001"
"86","11527007","2001 Jan","Dumont FJ","Dumont FJ","Current opinion in investigational drugs (London, England : 2000)","Alemtuzumab (Millennium/ILEX).","2001"
"87","11510560","2001 Jul 20","Ghosh R","Ghosh R","Journal of chromatography. A","Separation of proteins using hydrophobic interaction membrane chromatography.","2001"
"88","11477365","2001 Jul 27","Chakrabarti S","Milligan DW","Transplantation","Will mixed chimerism cure autoimmune diseases after a nonmyeloablative stem cell transplant?","2001"
"89","11461662","2001 Jun","Syrigos KN","Harrington KJ","Hybridoma","The development of monoclonal antibody therapy in leukemias.","2001"
"90","11449871","2001 Jul 1","Thompson CA","Thompson CA","American journal of health-system pharmacy : AJHP : official journal of the American Society of Health-System Pharmacists","Monoclonal antibody licensed for third-line treatment of B-cell chronic lymphocytic leukemia.","2001"
"91","11449628","2001 Jun","Schnell R","Engert A","Der Internist","[Clinical use of monoclonal antibodies in malignant lymphomas].","2001"
"92","11441256","2000 Dec","Schulz H","Engert A","Onkologie","The Monoclonal Antibodies Campath-1H and Rituximab in theTherapy of Chronic Lymphocytic Leukemia.","2000"
"93","11438820","2001 May","Barge RM","Fibbe WE","Bone marrow transplantation","Comparison of allogeneic T cell-depleted peripheral blood stem cell and bone marrow transplantation: effect of stem cell source on short- and long-term outcome.","2001"
"94","11420384","2001 Jul","Yeung CH","Cooper TG","Molecular human reproduction","Changes of the major sperm maturation-associated epididymal protein HE5 (CD52) on human ejaculated spermatozoa during incubation.","2001"
"95","11418459","2001 Jul 1","Rawstron AC","Hillmen P","Blood","Quantitation of minimal disease levels in chronic lymphocytic leukemia using a sensitive flow cytometric assay improves the prediction of outcome and can be used to optimize therapy.","2001"
"96","11377483","2001 May","Granot E","Aker M","Transplantation proceedings","Monoclonal anti-CD52 antibodies: a potential mode of therapy for parvovirus B(19) hepatitis.","2001"
"97","11375079","2001 May 29","Calne RY","Calne RY","Philosophical transactions of the Royal Society of London. Series B, Biological sciences","The future of organ transplantation: from the laboratory to the clinic.","2001"
"98","11360116","2001 Apr","Miano M","Dini G","Bone marrow transplantation","Four year follow-up of a case of fucosidosis treated with unrelated donor bone marrow transplantation.","2001"
"99","11298593","2001 Mar","Fracchiolla NS","Cortelezzi A","British journal of haematology","Biological and molecular characterization of PNH-like lymphocytes emerging after Campath-1H therapy.","2001"
"100","11296131","2001 May","Weiss MA","Weiss MA","Current oncology reports","Novel treatment strategies in chronic lymphocytic leukemia.","2001"
"101","11277178","2001 Feb","Qamruddin AO","Chopra R","Bone marrow transplantation","Screening for cytomegalovirus (CMV) infection in allogeneic bone marrow transplantation using a quantitative whole blood polymerase chain reaction (PCR) method: analysis of potential risk factors for CMV infection.","2001"
"102","11268323","2000 Nov","Lanfranchi A","Porta F","Haematologica","Haploidentical peripheral blood and marrow stem cell transplantation in nine cases of primary immunodeficiency.","2000"
"103","11257744","2001 Mar-Apr","Domagała A","Kurpisz M","Medical science monitor : international medical journal of experimental and clinical research","CD52 antigen--a review.","2001"
"104","11249458","2000 May","Rienks A","Rienks A","Nephrology news &amp; issues","Almost-tolerance halves cyclosporine dose.","2000"
"105","11219009","2001","Allen G","Allen G","Metal ions in biological systems","Specific protein degradation by copper(II) ions.","2001"
"106","11160771","2001","White CA","Grillo-López AJ","Annual review of medicine","Antibody-targeted immunotherapy for treatment of malignancy.","2001"
"107","11158184","2001 Feb 7","Finkelstein JB","Finkelstein JB","Journal of the National Cancer Institute","FDA panel recommends two new cancer drugs for approval.","2001"
"108","11149212","2000 Dec 8","Geissler M","Blum HE","Deutsche medizinische Wochenschrift (1946)","[Therapeutic monoclonal antibodies].","2000"
"109","11147488","2000 Oct","Davis AT","Davis AT","Seminars in hematology","Monoclonal antibody-based therapy of lymphoid neoplasms: what's on the horizon?","2000"
"110","11128816","2000","Marks DI","Oakhill A","Biology of blood and marrow transplantation : journal of the American Society for Blood and Marrow Transplantation","T cell-depleted unrelated donor bone marrow transplantation for acute myeloid leukemia.","2000"
"111","11122838","2000 Mar","McLaughlin P","McLaughlin P","Current oncology reports","Biotherapy for lymphoma.","2000"
"112","11085457","2000 Nov","Flynn JM","Byrd JC","Current opinion in oncology","Campath-1H monoclonal antibody therapy.","2000"
"113","11045999","2000 Nov 1","Graca L","Waldmann H","Journal of immunology (Baltimore, Md. : 1950)","Cutting edge: anti-CD154 therapeutic antibodies induce infectious transplantation tolerance.","2000"
"114","11040273","2000","Hainsworth JD","Hainsworth JD","The oncologist","Monoclonal antibody therapy in lymphoid malignancies.","2000"
"115","11037855","2000 Sep-Oct","Kapelushnik J","Nagler A","Journal of pediatric hematology/oncology","Fludarabine-based protocol for haploidentical peripheral blood stem cell transplantation in Hurler syndrome.","2000"
"116","11035276","2000 Oct","Bunjes D","Bunjes D","Transfusion science","T cell depletion of allogeneic stem cell grafts with anti-CD 52 monoclonal antibodies: the Ulm experience from 1983-1999.","2000"
"117","11022631","2000 Aug","Roux P","Novitzky N","South African medical journal = Suid-Afrikaanse tydskrif vir geneeskunde","The Cape Town experience with haematopoietic stem cell transplantation: the paediatric programme.","2000"
"118","11013436","2000 Nov","Yeung CH","Cooper TG","Molecular reproduction and development","Maturational changes of the CD52-like epididymal glycoprotein on cynomolgus monkey sperm and their apparent reversal in capacitation conditions.","2000"
"119","10960874","2000 Jun","Owen RG","Morgan GJ","Hematological oncology","Waldenström's macroglobulinaemia: laboratory diagnosis and treatment.","2000"
"120","10950363","2000 Aug","Byrd JC","Rai KR","Seminars in oncology","What choices are available for treatment of the patient with chronic lymphocytic leukemia who is fludarabine-refractory?","2000"
"121","10918407","2000 Jul","Hale G","Waldmann H","Bone marrow transplantation","CD52 antibodies for prevention of graft-versus-host disease and graft rejection following transplantation of allogeneic peripheral blood stem cells.","2000"
"122","10907481","1999 Jun","Rai KR","Rai KR","Haematologica","Chronic lymphocytic leukaemia. Current strategy and new perspectives of treatment.","1999"
"123","10894353","2000 Jun","Simpson D","Simpson D","Journal of hematotherapy &amp; stem cell research","Drug therapy for acute graft-versus-host disease prophylaxis.","2000"
"124","10891435","2000 Jul 1","Craddock C","Goldman JM","Blood","Estimating leukemia-free survival after allografting for chronic myeloid leukemia: a new method that takes into account patients who relapse and are restored to complete remission.","2000"
"125","10889906","2000 Apr","McElveen JE","Shakib F","Molecular pathology : MP","Characterisation of a mouse monoclonal anti-idiotype reactive with a V region sequence commonly used by human immunoglobulins.","2000"
"126","10877047","2000 Apr","Dearden CE","Catovsky D","Seminars in oncology","Clinical overview of pentostatin (Nipent) use in lymphoid malignancies.","2000"
"127","10845940","2000 Jun 15","Champlin RE","Horowitz MM","Blood","T-cell depletion of bone marrow transplants for leukemia from donors other than HLA-identical siblings: advantage of T-cell antibodies with narrow specificities.","2000"
"128","10848438","1999 Dec","Hale G","Hale G","Transfusion science","Recent developments in humanized MAbs for immunotherapy: a personal tribute to Dr. Martin Lockwood.","1999"
"129","10798754","2000 Apr 15","Novitzky N","Thomas VL","Transplantation","Bone marrow transplantation depleted of T cells followed by repletion with incremental doses of donor lymphocytes for relapsing patients with chronic myeloid leukemia: a therapeutic strategy.","2000"
"130","10798751","2000 Apr 15","Davison GM","Waldmann H","Transplantation","Immune reconstitution after allogeneic bone marrow transplantation depleted of T cells.","2000"
"131","10792280","2000 Mar","Cull GM","Russell NH","British journal of haematology","Preliminary experience of allogeneic stem cell transplantation for lymphoproliferative disorders using BEAM-CAMPATH conditioning: an effective regimen with low procedure-related toxicity.","2000"
"132","10761013","1998 Jan","Matutes E","Matutes E","Cancer control : journal of the Moffitt Cancer Center","T-cell Prolymphocytic Leukemia.","1998"
"133","10752996","2000 Apr","Dybjer A","Billström R","Leukemia &amp; lymphoma","Seropositive polyarthritis and skin manifestations in T-prolymphocytic leukemia/Sezary cell leukemia variant.","2000"
"134","10744652","2000 Apr","Hederer RA","Alexander DR","International immunology","The CD45 tyrosine phosphatase regulates Campath-1H (CD52)-induced TCR-dependent signal transduction in human T cells.","2000"
