"","id","pubdate","firstauthor","lastauthor","source","title","year"
"135","10723585","2000 Feb","Byrne JL","Russell NH","Bone marrow transplantation","The effect of the serotherapy regimen used and the marrow cell dose received on rejection, graft-versus-host disease and outcome following unrelated donor bone marrow transplantation for leukaemia.","2000"
"136","10713664","2000 Feb","Pangalis GA","Siakantaris MP","Medical oncology (Northwood, London, England)","Campath-1H in B-chronic lymphocytic leukemia: report on a patient treated thrice in a 3 year period.","2000"
"137","21337085","2000","Glennie MJ","Tutt AL","Methods in molecular medicine","The application of monoclonal antibodies in the treatment of lymphoma.","2000"
"138","10611109","2000 Jan","Dick AD","Isaacs JD","The British journal of ophthalmology","Campath-1H therapy in refractory ocular inflammatory disease.","2000"
"139","10573085","1999 Nov 15","Rebello PR","Waldmann H","Transplantation","Anti-globulin responses to rat and humanized CAMPATH-1 monoclonal antibody used to treat transplant rejection.","1999"
"140","10565991","1999 Jan","","","Drugs in R&amp;D","Campath-1G. Campath IgG, Campath-1-IgG antibody.","1999"
"141","10561025","1999 Oct","Keating MJ","Keating MJ","Seminars in oncology","Chronic lymphocytic leukemia.","1999"
"142","10561018","1999 Oct","Dyer MJ","Dyer MJ","Seminars in oncology","The role of CAMPATH-1 antibodies in the treatment of lymphoid malignancies.","1999"
"143","10528911","1999 Oct","Rai KR","Rai KR","Seminars in hematology","Future strategies toward the cure of indolent B-cell malignancies. New biologic therapies.","1999"
"144","10524207","1999 Sep 3","Tone M","Waldmann H","Biochimica et biophysica acta","Structure and chromosomal location of mouse and human CD52 genes.","1999"
"145","10520035","1999 Oct","Rawstron AC","Hillmen P","British journal of haematology","The PNH phenotype cells that emerge in most patients after CAMPATH-1H therapy are present prior to treatment.","1999"
"146","10498590","1999 Oct 1","Curtis RE","Deeg HJ","Blood","Risk of lymphoproliferative disorders after bone marrow transplantation: a multi-institutional study.","1999"
"147","10498594","1999 Oct 1","Green A","Pamphilon DH","Blood","Children with acute lymphoblastic leukemia who receive T-cell-depleted HLA mismatched marrow allografts from unrelated donors have an increased incidence of primary graft failure but a similar overall transplant outcome.","1999"
"148","10489036","1999 Sep 11","Paolillo A","Miller DH","Neurology","Quantitative MRI in patients with secondary progressive MS treated with monoclonal antibody Campath 1H.","1999"
"149","10477459","1999 Sep","Locatelli F","Martini A","Haematologica","Mobilization and selection of peripheral blood hematopoietic progenitors in children with systemic sclerosis.","1999"
"150","10444204","1999 Jul","Otton SH","Johnson SA","British journal of haematology","Autoimmune thrombocytopenia after treatment with Campath 1H in a patient with chronic lymphocytic leukaemia.","1999"
"151","10417047","1999 Jun","Mumcuoglu M","Slavin S","Journal of hematotherapy","Enhancement of hematopoietic reconstitution with recombinant cytokines: effect of rhIL-6 in combination with rhGM-CSF and rhIL-3 on unmodified or T cell-depleted bone marrow.","1999"
"152","10366506","1999 Jun 4","James LC","Bloomer AC","Journal of molecular biology","1.9 A structure of the therapeutic antibody CAMPATH-1H fab in complex with a synthetic peptide antigen.","1999"
"153","10335520","1999 Apr","Smith PF","Darlington CL","Multiple sclerosis (Houndmills, Basingstoke, England)","Recent developments in drug therapy for multiple sclerosis.","1999"
"154","10329437","1999 May 19","Focarelli R","Rosati F","Biochemical and biophysical research communications","Biochemical and MALDI analysis of the human sperm antigen gp20, homologue of leukocyte CD52.","1999"
"155","10211898","1999 Apr","Martini A","Locatelli F","Arthritis and rheumatism","Marked and sustained improvement two years after autologous stem cell transplantation in a girl with systemic sclerosis.","1999"
"156","10092828","1999 Mar 15","Gilliland LK","Waldmann H","Journal of immunology (Baltimore, Md. : 1950)","Elimination of the immunogenicity of therapeutic antibodies.","1999"
"157","10071037","1999 Feb 27","Novitzky N","Waldmann H","Transplantation","Ex vivo depletion of T cells from bone marrow grafts with CAMPATH-1 in acute leukemia: graft-versus-host disease and graft-versus-leukemia effect.","1999"
"158","10050661","1999 Jan","Focarelli R","Rosati F","Molecular human reproduction","A sialoglycoprotein, gp20, of the human capacitated sperm surface is a homologue of the leukocyte CD52 antigen: analysis of the effect of anti-CD52 monoclonal antibody (CAMPATH-1) on capacitated spermatozoa.","1999"
"159","9866817","1998 Dec","Bonn D","Bonn D","Molecular medicine today","Leukocyte depletion for leukaemia and multiple sclerosis.","1998"
"160","9838682","1998 Nov","Calne R","Calne R","Transplantation proceedings","""Almost tolerance"" in the clinic.","1998"
"161","9834254","1998 Dec 1","Dumont-Girard F","Roosnek E","Blood","Reconstitution of the T-cell compartment after bone marrow transplantation: restoration of the repertoire by thymic emigrants.","1998"
"162","9824507","1998 Nov","Rowan W","Brett SJ","Immunology","Cross-linking of the CAMPATH-1 antigen (CD52) mediates growth inhibition in human B- and T-lymphoma cell lines, and subsequent emergence of CD52-deficient cells.","1998"
"163","9811544","1998 Nov 20","Cheetham GM","Bloomer AC","Journal of molecular biology","Crystal structures of a rat anti-CD52 (CAMPATH-1) therapeutic antibody Fab fragment and its humanized counterpart.","1998"
"164","9809379","1998 Sep","Brochet B","Brochet B","Revue neurologique","[Non-specific immunosuppression and multiple sclerosis].","1998"
"165","9777606","1998 Apr","Thurmond LM","Orban BS","Journal of pharmaceutical and biomedical analysis","A kinetic enzyme immunoassay for the quantitation of antibodies to a humanized monoclonal antibody in human serum.","1998"
"166","9747629","1998 Jul","Maloney DG","Maloney DG","Current opinion in hematology","Advances in immunotherapy of hematologic malignancies.","1998"
"167","9737590","1998 Sep 1","Stebbings R","Walker B","AIDS research and human retroviruses","Mechanisms of protection induced by attenuated simian immunodeficiency virus. II. Lymphocyte depletion does not abrogate protection.","1998"
"168","9734890","1998 Jun 6","Calne R","Waldmann H","Lancet (London, England)","Prope tolerance, perioperative campath 1H, and low-dose cyclosporin monotherapy in renal allograft recipients.","1998"
"169","9712499","1998 Jun","Cornelissen JJ","Brand R","Bone marrow transplantation","A retrospective Dutch study comparing T cell-depleted allogeneic blood stem cell transplantation vs T cell-depleted allogeneic bone marrow transplantation.","1998"
"170","9707017","1998 Jul","Clarke E","Pamphilon DH","Bone marrow transplantation","Double T cell depletion of bone marrow using sequential positive and negative cell immunoaffinity or CD34+ cell selection followed by Campath-1M; effect on CD34+ cells and progenitor cell recoveries.","1998"
"171","9668276","1998 May 13","Agius MA","Sanyal B","Annals of the New York Academy of Sciences","Homology of an antiacetylcholine receptor monoclonal antibody with a monoclonal antibody to Campath-1 antigen suggests usage of the same VH genes.","1998"
"172","9630324","1998 Apr","Veys PA","Davies G","Bone marrow transplantation","Haploidentical related transplants and unrelated donor transplants with T cell addback.","1998"
"173","9630323","1998 Apr","Miano M","Dini G","Bone marrow transplantation","Unrelated donor marrow transplantation for inborn errors.","1998"
"174","9593475","1998 Feb","Ginaldi L","Catovsky D","Leukemia research","Levels of expression of CD52 in normal and leukemic B and T cells: correlation with in vivo therapeutic responses to Campath-1H.","1998"
"175","9531622","1998 Apr 15","Hale G","Waldmann H","Blood","Risks of developing Epstein-Barr virus-related lymphoproliferative disorders after T-cell-depleted marrow transplants. CAMPATH Users.","1998"
"176","9578307","1998 Apr","Lowdell MW","Prentice HG","Bone marrow transplantation","The effect of T cell depletion with Campath-1M on immune reconstitution after chemotherapy and allogeneic bone marrow transplant as treatment for leukaemia.","1998"
"177","9509982","1998 Feb","Starobinski M","Chapuis B","Bone marrow transplantation","T cell depletion of allogeneic peripheral blood stem cells.","1998"
"178","9482528","1998 Feb","Byrd JC","Grever MR","Seminars in oncology","Old and new therapies in chronic lymphocytic leukemia: now is the time for a reassessment of therapeutic goals.","1998"
"179","9471061","1997 Nov","Montserrat E","Montserrat E","Hematology and cell therapy","New therapeutic issues in CLL.","1997"
"180","9464849","1997 Dec","Yeung CH","Nieschlag E","Molecular human reproduction","Human epididymal secreted protein CD52 on ejaculated spermatozoa: correlations with semen characteristics and the effect of its antibody.","1997"
"181","9367397","1997 Nov","Isaacs JD","Waldmann H","Clinical and experimental immunology","Humanized anti-CD4 monoclonal antibody therapy of autoimmune and inflammatory disease.","1997"
"182","9337063","1997 Oct","Clarke E","Pamphilon DH","Bone marrow transplantation","A laboratory comparison of T cell depletion by CD34+ cell immunoaffinity selection and in vitro Campath-1M treatment: clinical implications for bone marrow transplantation and donor leukocyte therapy.","1997"
"183","9337053","1997 Oct","Nagler A","Deutsch VR","Bone marrow transplantation","Enhancement of megakaryocytopoiesis by Campath-1G-treated natural killer cells.","1997"
"184","9291477","1997 Oct","Yeung CH","Cooper TG","Molecular reproduction and development","Interaction of the human epididymal protein CD52 (HE5) with epididymal spermatozoa from men and cynomolgus monkeys.","1997"
"185","9228156","1997 Jul","Finnegan A","Schnitzer TJ","The Journal of rheumatology","Persistence of CD4+ T cells in the arthritic joint after CAMPATH-1H treatment.","1997"
"186","9204983","1997 Jul","Pawson R","Catovsky D","Leukemia","Sezary cell leukaemia: a distinct T cell disorder or a variant form of T prolymphocytic leukaemia?","1997"
"187","9188478","1997 Jun 20","Smith GK","Wolfe LA 3rd","The Journal of biological chemistry","Toward antibody-directed enzyme prodrug therapy with the T268G mutant of human carboxypeptidase A1 and novel in vivo stable prodrugs of methotrexate.","1997"
"188","9207420","1997 Jun","Dyer MJ","Catovsky D","British journal of haematology","In vivo 'purging' of residual disease in CLL with Campath-1H.","1997"
"189","9163593","1997 May","Killick SB","Gordon-Smith EC","British journal of haematology","Sustained remission of severe resistant autoimmune neutropenia with Campath-1H.","1997"
"190","9126378","1997 Apr 5","Sheeley DM","Taylor LC","Analytical biochemistry","Characterization of monoclonal antibody glycosylation: comparison of expression systems and identification of terminal alpha-linked galactose.","1997"
"191","9148769","1997 Mar 15","Taylor VC","Field MC","The Biochemical journal","Antibody selection against CD52 produces a paroxysmal nocturnal haemoglobinuria phenotype in human lymphocytes by a novel mechanism.","1997"
"192","9054677","1997 Mar","Collins P","Veys P","British journal of haematology","Successful engraftment of haploidentical stem cell transplant for familial haemophagocytic lymphohistiocytosis using both bone marrow and peripheral blood stem cells.","1997"
"193","9054672","1997 Mar","Bowen AL","Catovsky D","British journal of haematology","Subcutaneous CAMPATH-1H in fludarabine-resistant/relapsed chronic lymphocytic and B-prolymphocytic leukaemia.","1997"
"194","9051241","1997 Feb","Dickinson AM","Cant AJ","Bone marrow transplantation","In vitro T cell depletion using Campath 1M for mismatched BMT for severe combined immunodeficiency (SCID).","1997"
"195","9020367","1997 Jan","Osterborg A","Mellstedt H","European journal of haematology","Clonal CD8+ and CD52- T cells are induced in responding B cell lymphoma patients treated with Campath-1H (anti-CD52).","1997"
"196","8981930","1996 Dec 15","Wing MG","Compston A","The Journal of clinical investigation","Mechanism of first-dose cytokine-release syndrome by CAMPATH 1-H: involvement of CD16 (FcgammaRIII) and CD11a/CD18 (LFA-1) on NK cells.","1996"
"197","9137963","1996 Dec","Catovsky D","Catovsky D","Hematology and cell therapy","Clinical experience with 2'-deoxycoformycin.","1996"
"198","8973608","1996 Dec","Isaacs JD","Waldmann H","Clinical and experimental immunology","A therapeutic human IgG4 monoclonal antibody that depletes target cells in humans.","1996"
"199","8899185","1996 Oct","Condiotti R","Nagler A","Bone marrow transplantation","Campath-1G impairs human natural killer (NK) cell-mediated cytotoxicity.","1996"
"200","8790160","1996 Sep","Oakhill A","Cornish JM","British journal of haematology","Unrelated donor bone marrow transplantation for children with relapsed acute lymphoblastic leukaemia in second complete remission.","1996"
"201","8784367","1996 Sep","Jabado N","Fischer A","Pediatrics","Bone marrow transplantation from genetically HLA-nonidentical donors in children with fatal inherited disorders excluding severe combined immunodeficiencies: use of two monoclonal antibodies to prevent graft rejection.","1996"
"202","8864469","1996 Aug","Nagler A","Or R","Bone marrow transplantation","In vivo CAMPATH-1 followed by T cell-depleted bone marrow transplantation: a potential new mode of therapy for hepatitis-associated severe aplastic anemia (SAA).","1996"
"203","8864449","1996 Aug","Gerritsen EJ","Vossen JM","Bone marrow transplantation","Risk factors for developing EBV-related B cell lymphoproliferative disorders (BLPD) after non-HLA-identical BMT in children.","1996"
"204","9345418","1996 Jul","Moreau T","Compston A","Multiple sclerosis (Houndmills, Basingstoke, England)","CAMPATH-IH in multiple sclerosis.","1996"
"205","8844262","1996 Jul","Smith MA","Allen G","International journal of peptide and protein research","Specific cleavage of immunoglobulin G by copper ions.","1996"
"206","8756101","1996 Jul","Varadi G","Nagler A","American journal of hematology","In vivo CAMPATH-1 monoclonal antibodies: a novel mode of therapy for acute graft-versus-host disease.","1996"
"207","8690051","1996 Jul","de Kroon JF","Falkenburg JH","Experimental hematology","Anti-CD45 and anti-CD52 (Campath) monoclonal antibodies effectively eliminate systematically disseminated human non-Hodgkin's lymphoma B cells in Scid mice.","1996"
"208","8782148","1996 Jun","Isaacs JD","Waldmann H","The Journal of rheumatology","Monoclonal antibody therapy of diffuse cutaneous scleroderma with CAMPATH-1H.","1996"
"209","8690449","1996 Jun","Hale C","Tite J","Immunology","Recognition of CD52 allelic gene products by CAMPATH-1H antibodies.","1996"
"210","8733715","1996 May","Mehta J","Catovsky D","Bone marrow transplantation","T cell-depleted allogeneic bone marrow transplantation from a partially HLA-mismatched unrelated donor for progressive chronic lymphocytic leukemia and fludarabine-induced bone marrow failure.","1996"
"211","8733704","1996 May","Hamblin M","Gordon-Smith EC","Bone marrow transplantation","Campath-1G in vivo confers a low incidence of graft-versus-host disease associated with a high incidence of mixed chimaerism after bone marrow transplantation for severe aplastic anaemia using HLA-identical sibling donors.","1996"
"212","8611731","1996 May 1","Roux E","Roosnek E","Blood","Analysis of T-cell repopulation after allogeneic bone marrow transplantation: significant differences between recipients of T-cell depleted and unmanipulated grafts.","1996"
"213","8738190","1996 Mar","Lines AC","Lines AC","Journal of pharmaceutical and biomedical analysis","High-performance liquid chromatographic mapping of the oligosaccharides released from the humanised immunoglobulin, CAMPATH 1H.","1996"
"214","8620297","1996 Mar","Isaacs JD","Johnston JM","British journal of rheumatology","CAMPATH-1H in rheumatoid arthritis--an intravenous dose-ranging study.","1996"
"215","8624684","1996 Feb","Moreau T","Compston A","Brain : a journal of neurology","Transient increase in symptoms associated with cytokine release in patients with multiple sclerosis.","1996"
"216","9238651","1996 Jan","Kirchhoff C","Kirchhoff C","Molecular human reproduction","CD52 is the 'major maturation-associated' sperm membrane antigen.","1996"
"217","8562410","1996 Jan","Locatelli F","Paolucci G","British journal of haematology","Role of allogeneic bone marrow transplantation from an HLA-identical sibling or a matched unrelated donor in the treatment of children with juvenile chronic myeloid leukaemia.","1996"
"218","8546734","1996 Jan","Soriano ER","Maddison PJ","Arthritis and rheumatism","Synovial tissue responses following treatment of rheumatoid arthritis with the humanized monoclonal antibody CAMPATH-1H.","1996"
"219","8618827","1995 Dec 19","Hutchins JT","Ray P","Proceedings of the National Academy of Sciences of the United States of America","Improved biodistribution, tumor targeting, and reduced immunogenicity in mice with a gamma 4 variant of Campath-1H.","1995"
"220","9373346","1995 Dec","Hale G","Hale G","Immunotechnology : an international journal of immunological engineering","Synthetic peptide mimotope of the CAMPATH-1 (CD52) antigen, a small glycosylphosphatidylinositol-anchored glycoprotein.","1995"
"221","8750280","1995 Dec","Varadi G","Nagler A","Bone marrow transplantation","Severe migratory polyarthritis following in vivo CAMPATH-1G.","1995"
"222","8720080","1995 Dec","Lifely MR","Phillips J","Glycobiology","Glycosylation and biological activity of CAMPATH-1H expressed in different cell lines and grown under different culture conditions.","1995"
"223","8643100","1995 Dec","Boyd PN","Patel AK","Molecular immunology","The effect of the removal of sialic acid, galactose and total carbohydrate on the functional activity of Campath-1H.","1995"
"224","7491698","1995 Nov 15","Nagler A","Barak V","Transplantation","Elevated inflammatory cytokine levels in bone marrow graft rejection.","1995"
"225","8654681","1995 Nov","Hale G","Phillips JM","Biochemical Society transactions","Clinical trials with CAMPATH-I and other monoclonal antibodies.","1995"
"226","8534657","1995 Nov","Isaacs JD","Meyer PA","The British journal of ophthalmology","Monoclonal antibody therapy of chronic intraocular inflammation using Campath-1H.","1995"
"227","7579421","1995 Oct 15","Kapelushnik J","Oppenheim A","Blood","Analysis of beta-globin mutations shows stable mixed chimerism in patients with thalassemia after bone marrow transplantation.","1995"
"228","22358555","1995 Oct","Keen MJ","Rapson NT","Cytotechnology","Development of a serum-free culture medium for the large scale production of recombinant protein from a Chinese hamster ovary cell line.","1995"
"229","8991975","1995 Oct","Pruzanski W","Vadas P","The Journal of rheumatology","Induction of TNF-alpha and proinflammatory secretory phospholipase A2 by intravenous administration of CAMPATH-1H in patients with rheumatoid arthritis.","1995"
"230","7572995","1995 Oct","DelleKarth G","Simonitsch I","American journal of hematology","Clearance of PCR-detectable lymphoma cells from the peripheral blood, but not bone marrow after therapy with campath-1H.","1995"
"231","9358610","1995 Aug","Wing MG","Hale G","Therapeutic immunology","Ex-vivo whole blood cultures for predicting cytokine-release syndrome: dependence on target antigen and antibody isotype.","1995"
"232","7622867","1995 Jul 17","Patel AK","Boyd PN","Journal of immunological methods","An improved assay for antibody dependent cellular cytotoxicity based on time resolved fluorometry.","1995"
"233","7662637","1995 Jul","Webster AR","Moore AT","The British journal of ophthalmology","Ischaemic retinopathy occurring in patients receiving bone marrow allografts and campath-1G: a clinicopathological study.","1995"
"234","7557898","1995 Jul-Aug","Clark RE","Pender N","Hematological oncology","Transplantation of T-lymphocyte depleted marrow with an addback of T cells.","1995"
"235","7762066","1995 May 15","Spencer A","Batchelor JR","Transplantation","Cytotoxic T lymphocyte precursor frequency analyses in bone marrow transplantation with volunteer unrelated donors. Value in donor selection.","1995"
"236","7890742","1995 Mar 17","Treumann A","Ferguson MA","The Journal of biological chemistry","Primary structure of CD52.","1995"
"237","7762819","1995 Mar 1","Ashton DS","Smith MA","Analytical chemistry","Mass spectrometry of the humanized monoclonal antibody CAMPATH 1H.","1995"
"238","7734348","1995 Mar","Naparstek E","Tochner Z","British journal of haematology","T-cell-depleted allogeneic bone marrow transplantation for acute leukaemia using Campath-1 antibodies and post-transplant administration of donor's peripheral blood lymphocytes for prevention of relapse.","1995"
"239","7599563","1995 Mar","Hertenstein B","Mertens T","Bone marrow transplantation","In vivo/ex vivo T cell depletion for GVHD prophylaxis influences onset and course of active cytomegalovirus infection and disease after BMT.","1995"
"240","7773229","1995 Feb","Hale G","Waldmann H","Bone marrow transplantation","Availability of Campath-1 antibodies for bone marrow transplantation.","1995"
"241","7530212","1995 Feb","Dreger P","Schmitz N","Experimental hematology","G-CSF-mobilized peripheral blood progenitor cells for allogeneic transplantation: comparison of T cell depletion strategies using different CD34+ selection systems or CAMPATH-1.","1995"
"242","22358746","1995 Jan","Keen MJ","Hale C","Cytotechnology","The use of serum-free medium for the production of functionally active humanised monoclonal antibody from NS0 mouse myeloma cells engineered using glutamine synthetase as a selectable marker.","1995"
"243","8543073","1995","Newman DK","Waldmann H","Eye (London, England)","Prevention of immune-mediated corneal graft destruction with the anti-lymphocyte monoclonal antibody, CAMPATH-1H.","1995"
"244","7718516","1995 Jan","Rowan WC","Brett SJ","International immunology","Cross-linking of the CAMPATH-1 antigen (CD52) triggers activation of normal human T lymphocytes.","1995"
"245","7711666","1994 Dec","Chaushu S","Yefenof E","Bone marrow transplantation","Salivary immunoglobulins in recipients of bone marrow grafts. I. A longitudinal follow-up.","1994"
"246","7584499","1994 Oct","Greenwood J","Waldmann H","Therapeutic immunology","Engineering multiple-domain forms of the therapeutic antibody CAMPATH-1H: effects on complement lysis.","1994"
"247","7858503","1994 Sep","Lim SH","Ifthikharuddin JJ","Leukemia &amp; lymphoma","Autoimmune thrombocytopenic purpura complicating lymphoproliferative disorders.","1994"
"248","7914262","1994 Jul 30","Moreau T","Compston A","Lancet (London, England)","Preliminary evidence from magnetic resonance imaging for reduction in disease activity after lymphocyte depletion in multiple sclerosis.","1994"
"249","8054913","1994 May","Hale G","Waldmann H","Bone marrow transplantation","Control of graft-versus-host disease and graft rejection by T cell depletion of donor and recipient with Campath-1 antibodies. Results of matched sibling transplants for malignant diseases.","1994"
"250","8027367","1994 Apr","Salisbury JR","Nethersell AB","Journal of clinical pathology","Immunohistochemical analysis of CDw52 antigen expression in non-Hodgkin's lymphomas.","1994"
"251","8019459","1994 Jan","Or R","Slavin S","Bone marrow transplantation","Total lymphoid irradiation, anti-lymphocyte globulin and Campath 1-G for immunosuppression prior to bone marrow transplantation for aplastic anemia after repeated graft rejection.","1994"
"252","7997943","1994","Pall AA","Savage CO","Springer seminars in immunopathology","Mechanisms of endothelial cell injury in vasculitis.","1994"
"253","8260716","1993 Dec 15","Nagakura S","Kagimoto T","Blood","A deficiency in CDw52 (CAMPATH-1 antigen) of paroxysmal nocturnal hemoglobinuria lymphocytes.","1993"
"254","8405234","1993 Nov","Fabian I","Nagler A","Experimental hematology","Effects of CAMPATH-1 antibodies on the functional activity of monocytes and polymorphonuclear neutrophils.","1993"
"255","8405223","1993 Oct","Deutsch VR","Eldor A","Experimental hematology","Effect of bone marrow T lymphocytes treated with CAMPATH 1G on megakaryocyte colony formation.","1993"
"256","8241978","1993 Sep","Bunjes D","Heimpel H","Bone marrow transplantation","Graft rejection by a population of primed CDw52- host T cells after in vivo/ex vivo T-depleted bone marrow transplantation.","1993"
"257","8366859","1993 Aug","Xia MQ","Waldmann H","Molecular immunology","Efficient complement-mediated lysis of cells containing the CAMPATH-1 (CDw52) antigen.","1993"
"258","7688956","1993 Aug 1","Xia MQ","Waldmann H","The Biochemical journal","Structure of the CAMPATH-1 antigen, a glycosylphosphatidylinositol-anchored glycoprotein which is an exceptionally good target for complement lysis.","1993"
"259","7687895","1993 Aug 1","Gilleece MH","Dexter TM","Blood","Effect of Campath-1H antibody on human hematopoietic progenitors in vitro.","1993"
"260","8217808","1993 Jul","Lim SH","Baglin TP","British journal of haematology","CAMPATH-1 monoclonal antibody therapy in severe refractory autoimmune thrombocytopenic purpura.","1993"
"261","8477804","1993 May","Greenwood J","Waldmann H","European journal of immunology","Structural motifs involved in human IgG antibody effector functions.","1993"
"262","8096935","1993 Apr 17","Poynton CH","Maughan TS","Lancet (London, England)","Adverse reactions to Campath-1H monoclonal antibody.","1993"
