"","id","pubdate","firstauthor","lastauthor","source","title","year"
"263","7685389","1993 Mar","Hale G","Brito-Babapulle A","Journal of reproductive immunology","The glycosylphosphatidylinositol-anchored lymphocyte antigen CDw52 is associated with the epididymal maturation of human spermatozoa.","1993"
"264","8094189","1993 Feb 13","Lim SH","Marcus R","Lancet (London, England)","Differential response in a patient treated with Campath-1H monoclonal antibody for refractory non-Hodgkin lymphoma.","1993"
"265","8448560","1993","Lanino E","Marenco P","Bone marrow transplantation","Bone marrow transplantation from unrelated donors: the Italian experience. GITMO, AIEOP and IBMDR.","1993"
"266","8448531","1993","Cullis JO","Hows JM","Bone marrow transplantation","Matched unrelated donor bone marrow transplantation for chronic myeloid leukaemia in chronic phase: comparison of ex vivo and in vivo T-cell depletion.","1993"
"267","8124250","1993","Arnold R","Waldmann H","Bone marrow transplantation","In vitro and in vivo depletion of T cells.","1993"
"268","1384718","1992 Nov 15","Perry AC","Hall L","Biochimica et biophysica acta","Identification of an abundant monkey epididymal transcript encoding a homologue of human CAMPATH-1 antigen precursor.","1992"
"269","1635559","1992 Jul-Aug","Carroll AR","Clarke BE","Molecular immunology","Synthesis and secretion of a functional antibody in a vaccinia virus expression system.","1992"
"270","1390211","1992 Jul","Marks DI","Hows JM","British journal of haematology","HLA-identical sibling donor bone marrow transplantation for chronic myeloid leukaemia in first chronic phase: influence of GVHD prophylaxis on outcome.","1992"
"271","1352921","1992 Jul","Valentin H","Bernard A","Transplantation","The distribution of the CDW52 molecule on blood cells and characterization of its involvement in T cell activation.","1992"
"272","1600413","1992 Apr","Willemze R","Fibbe WE","Bone marrow transplantation","In vivo use of Campath-1G to prevent graft-versus-host disease and graft rejection after bone marrow transplantation.","1992"
"273","1581219","1992 Mar","Labadie J","Vossen JM","British journal of haematology","Transfer of specific immunity from donor to recipient of an allogeneic bone marrow graft: effect of conditioning on the specific immune response of the graft recipient.","1992"
"274","1543952","1992 Jan","Jurges E","Hobbs JR","Bone marrow transplantation","Transmission of toxoplasmosis by bone marrow transplant associated with Campath-1G.","1992"
"275","1504665","1992","Slavin S","Lewin A","Bone marrow transplantation","Clinical application of intrauterine bone marrow transplantation for treatment of genetic diseases--feasibility studies.","1992"
"276","1438436","1992","Fasth A","de los Angeles Umaña M","Progress in clinical and biological research","Campath-1M antibodies for T cell depletion of haploidentical marrow transplanted to children with malignant osteopetrosis.","1992"
"277","1339322","1992 Jan","Crowe JS","Tite JP","Clinical and experimental immunology","Humanized monoclonal antibody CAMPATH-1H: myeloma cell expression of genomic constructs, nucleotide sequence of cDNA constructs and comparison of effector mechanisms of myeloma and Chinese hamster ovary cell-derived material.","1992"
"278","1787497","1991 Nov","Kyle V","Waldmann H","The Journal of rheumatology","Humanized monoclonal antibody treatment in rheumatoid arthritis.","1991"
"279","1908152","1991 Aug","Friend PJ","Calne RY","Transplantation proceedings","Reversal of allograft rejection using the monoclonal antibody, Campath-1G.","1991"
"280","1799264","1991 Jul","Friend PJ","Friend PJ","Annals of the Academy of Medicine, Singapore","Monoclonal antibodies in immunosuppression.","1991"
"281","1711975","1991 Jul","Xia MQ","Waldmann H","European journal of immunology","Characterization of the CAMPATH-1 (CDw52) antigen: biochemical analysis and cDNA cloning reveal an unusually small peptide backbone.","1991"
"282","1903536","1991 May 15","Gorman SD","Waldmann H","Proceedings of the National Academy of Sciences of the United States of America","Reshaping a therapeutic CD4 antibody.","1991"
"283","2070132","1991 Apr","Morecki S","Slavin S","Bone marrow transplantation","The effect of in vitro T lymphocyte depletion on generation of IL2-activated cytotoxic cells.","1991"
"284","1985691","1991 Jan 15","Fischer A","Griscelli C","Blood","Reduction of graft failure by a monoclonal antibody (anti-LFA-1 CD11a) after HLA nonidentical bone marrow transplantation in children with immunodeficiencies, osteopetrosis, and Fanconi's anemia: a European Group for Immunodeficiency/European Group for Bone Marrow Transplantation report.","1991"
"285","27464246","1991","Dyer MJ","Marcus RE","Leukemia &amp; lymphoma","T-Cell Receptor and Immunoglobulin Gene Rearrangements in Acute Myeloid and Undifferentiated Leukemias of Adults: Correlation with Weak Surface Expression of CD45 and CDw52 Antigens.","1991"
"286","2043872","1991 Jan","Schroeder H","McElwain TJ","Bone marrow transplantation","High dose melphalan and total body irradiation with autologous marrow rescue in childhood acute lymphoblastic leukaemia after relapse.","1991"
"287","1998598","1991 Jan","Mackinnon S","Goldman JM","British journal of haematology","Origin and function of adherent lymphokine activated killer cells in patients with chronic myeloid leukaemia who relapse following bone marrow transplantation.","1991"
"288","1878698","1991","Martinelli G","Pignatti PF","Bone marrow transplantation","An assessment of chimeric transcript detection in CML patients after bone marrow transplantation.","1991"
"289","1675214","1991","Jacobs P","Horak S","Journal of clinical apheresis","Collection and cryopreservation of human stem and progenitor cells for bone marrow transplantation.","1991"
"290","1367214","1991 Jan","Page MJ","Sydenham MA","Bio/technology (Nature Publishing Company)","High level expression of the humanized monoclonal antibody Campath-1H in Chinese hamster ovary cells.","1991"
"291","2238056","1990 Nov","Eppinger T","Dopfer R","Transplantation","8-Methoxypsoralen and ultraviolet A therapy for cutaneous manifestations of graft-versus-host disease.","1990"
"292","2104246","1990 Oct-Nov","White DJ","Obers A","European cytokine network","The significance of tumour necrosis factor serum levels in organ transplantation.","1990"
"293","2338131","1990 Jun","Mackinnon S","Catovsky D","Experimental hematology","Bone marrow transplantation for chronic myeloid leukemia: the use of histocompatible unrelated volunteer donors.","1990"
"294","2323363","1990 May","Law P","Dooley DC","Experimental hematology","Purification of peripheral blood hematopoietic cells using Campath-1M monoclonal antibody.","1990"
"295","2328322","1990 Apr 15","McGlave PB","Hows JM","Blood","Therapy for chronic myelogenous leukemia with unrelated donor bone marrow transplantation: results in 102 cases.","1990"
"296","2337682","1990 Apr","Mergenthaler HG","Dörmer P","Blut","In vitro hemopoiesis in human micro long-term bone marrow cultures recharged with either allogeneic, T-cell-depleted allogeneic, or syngeneic bone marrow cells.","1990"
"297","2346286","1990 Mar","White DJ","Obers A","Annals of the Academy of Medicine, Singapore","Tumour necrosis factor in organ transplantation.","1990"
"298","2184907","1990 Mar","Mumcuoglu M","Slavin S","Bone marrow transplantation","The use of recombinant cytokines for enhancing immunohematopoietic reconstitution following bone marrow transplantation. II. The influence of lymphokines on CFU-GM colonies from human untreated, ASTA-Z or Campath-1M treated bone marrow.","1990"
"299","2180151","1990 Mar","Theobald M","Heit W","Transplantation","Comparative analysis of in vivo T cell depletion with radiotherapy, combination chemotherapy, and the monoclonal antibody Campath-1G, using limiting dilution methodology.","1990"
"300","2165283","1990 Mar","Hale G","Waldmann H","Tissue antigens","The CAMPATH-1 antigen (CDw52).","1990"
"301","2138367","1990 Mar","Dreger P","Müller-Ruchholtz W","Transplantation","Evidence that reduction of immunogenicity of T-depleted bone marrow depends on additional depletion of accessory cells. Implications for prevention of graft rejection.","1990"
"302","27463993","1990","Ben-Bassat H","Slavin S","Leukemia &amp; lymphoma","Reactivity of Human Monoclonal Antibody Campath-1 with Human Leukemia Lymphoma Cell Lines of Varying Maturation.","1990"
"303","27456733","1990","Dyer MJ","Waldmann H","Leukemia &amp; lymphoma","Remission Induction in Patients with Lymphoid Malignancies Using Unconjugated CAMPATH-1 Monoclonal Antibodies.","1990"
"304","2308978","1990","Cobbold SP","Waldmann H","Progress in clinical and biological research","Purging in auto- and allografts: monoclonal antibodies which use human complement and other natural effector mechanisms.","1990"
"305","1713884","1990","Leiblein S","Helbig W","Folia haematologica (Leipzig, Germany : 1928)","T-cell depletion and haematological side effects of two cytotoxic monoclonal antibodies.","1990"
"306","2692692","1989 Dec","Bianchi AC","Brenner MK","British journal of haematology","Enhancement of monoclonal antibody dependent cell mediated cytotoxicity by IL2 and GM-CSF.","1989"
"307","2790337","1989 Sep","Marsh JC","Hows JM","Bone marrow transplantation","Recurrent graft failure following syngeneic bone marrow transplantation for aplastic anaemia.","1989"
"308","2671531","1989 Jun 3","Conde E","Bello C","Medicina clinica","[Prevention of acute graft versus host disease using 3 prophylactic schemes].","1989"
"309","2660360","1989 Jun","Frame JN","Kernan NA","Transplantation","T cell depletion of human bone marrow. Comparison of Campath-1 plus complement, anti-T cell ricin A chain immunotoxin, and soybean agglutinin alone or in combination with sheep erythrocytes or immunomagnetic beads.","1989"
"310","2786388","1989 May","Kyle V","Hazleman BL","Annals of the rheumatic diseases","Beneficial effect of monoclonal antibody to interleukin 2 receptor on activated T cells in rheumatoid arthritis.","1989"
"311","2713487","1989 May 1","Dyer MJ","Waldmann H","Blood","Effects of CAMPATH-1 antibodies in vivo in patients with lymphoid malignancies: influence of antibody isotype.","1989"
"312","2661437","1989 May-Jun","Schmeiser T","Kurrle E","Infection","Infectious complications after allogeneic bone marrow transplantation with and without T-cell depletion of donor marrow.","1989"
"313","2910352","1989 Jan","Fibach E","Rachmilewitz EA","Blood","Proliferation and maturation of human erythroid progenitors in liquid culture.","1989"
"314","2784335","1989 Jan","Frame JN","Kernan NA","Bone marrow transplantation","Optimal conditions for in vitro T cell depletion of human bone marrow by Campath-1a plus complement as demonstrated by limiting dilution analysis.","1989"
"315","2472335","1989","Phan DT","Hollán SR","Folia haematologica (Leipzig, Germany : 1928)","Cercopithecus aethiops monkey as a reliable model for in vitro study of T cell depletion of bone marrow with Campath-1 plus complement.","1989"
"316","3067007","1988 Oct 22","Iriondo A","Zubizarreta A","Medicina clinica","[Prevention of graft versus host disease by in vitro depletion of T lymphocytes with monoclonal antibodies (Campath-1) in patients undergoing bone marrow transplantation].","1988"
"317","2973413","1988 Oct","Bindon CI","Waldmann H","European journal of immunology","Importance of antigen specificity for complement-mediated lysis by monoclonal antibodies.","1988"
"318","3263310","1988 Aug","Schofer O","Johnson FL","Immunitat und Infektion","[The effect of Campath-1 on T- and NK-cells].","1988"
"319","3291930","1988 Jun","Apperley JF","Wardle D","British journal of haematology","Bone marrow transplantation for chronic myeloid leukaemia in first chronic phase: importance of a graft-versus-leukaemia effect.","1988"
"320","3048491","1988 May","Bell AJ","Hamblin TJ","Bone marrow transplantation","Immunological reconstitution after bone marrow transplantation with Campath-1 treated bone marrow.","1988"
"321","3048490","1988 May","Hale G","Dyer M","Bone marrow transplantation","Specificity of monoclonal antibody Campath-1.","1988"
"322","3282358","1988 Apr","Hale G","Waldmann H","Transplantation","T cell depletion with CAMPATH-1 in allogeneic bone marrow transplantation.","1988"
"323","2452479","1988 Mar 12","Chapuis B","Wacker P","Schweizerische medizinische Wochenschrift","[Super intensive treatment followed by bone marrow autograft in cases of hematologic neoplasms and solid tumors].","1988"
"324","3043753","1988 Mar","Sutedja TG","Goldman JM","Thorax","Pulmonary function after bone marrow transplantation for chronic myeloid leukaemia.","1988"
"325","3278419","1988 Feb","Gerritsen WR","van Bekkum DW","Transplantation","The repopulation capacity of bone marrow grafts following pretreatment with monoclonal antibodies against T lymphocytes in rhesus monkeys.","1988"
"326","3257510","1988 Jan 21","Clark DM","Boylston AW","Journal of immunological methods","An ELISA method for detecting antibodies to the T cell antigen receptor.","1988"
"327","3260131","1988","Tazzari PL","Stirpe F","Cancer immunology, immunotherapy : CII","An immunotoxin containing a rat IgM monoclonal antibody (Campath 1) and saporin 6: effect on T lymphocytes and hemopoietic cells.","1988"
"328","3122385","1988 Jan","Tighe H","Waldmann H","Transplantation","Delayed allograft rejection in primates treated with anti-IL-2 receptor monoclonal antibody Campath-6.","1988"
"329","3061978","1988","Or R","Rachmilewitz EA","Hemoglobin","Bone marrow transplantation in beta-thalassemia major. The Israeli experience.","1988"
"330","3332190","1987 Dec","Gazitt Y","Slavin S","Bone marrow transplantation","Monoclonal rat anti-human lymphocyte antibody Campath-1 binds to T and B lymphocytes but effectively lyses only T cells.","1987"
"331","3609184","1987 Aug","Baines P","Jacobs A","Experimental hematology","Enrichment of progenitor cells from human marrow.","1987"
"332","3623632","1987 Jun","de Giorgi L","Rodeck CH","Immunology letters","The inheritance of a Macaca fascicularis red cell antigen detected by CAMPATH-1 antibody.","1987"
"333","2953090","1987 Apr","Bunjes D","Heimpel H","Transplantation","Evidence for the involvement of host-derived OKT8-positive T cells in the rejection of T-depleted, HLA-identical bone marrow grafts.","1987"
"334","3548798","1987 Feb","Lawler SD","Powles RL","British journal of haematology","Cytogenetic follow-up studies of recipients of T-cell depleted allogeneic bone marrow.","1987"
"335","3545877","1987 Feb","Irlé C","Jeannet M","Experimental hematology","Quantity and nature of residual bone marrow T cells after treatment of the marrow with Campath-1.","1987"
"336","2879121","1987 Jan 3","Waldmann H","Hale G","Lancet (London, England)","Leukaemic relapse after Campath 1-treated bone-marrow transplantation for leukaemia.","1987"
"337","3501389","1987","Phan DT","Hollán SR","Haematologia","Comparison of efficiency of complements from various species for T-cell depletion from Cercopithecus aethiops bone marrow with Campath-1 MoAb in vitro.","1987"
"338","3500899","1987","Phan DT","Hollán SR","Haematologia","T-cell depletion of Cercopithecus aethiops monkey bone marrow with Campath-1 monoclonal antibody and complement.","1987"
"339","3331647","1987 Summer","Gobbi M","Tura S","Journal of experimental pathology","An immunotoxin made up with campath 1 and saporin 6: preliminary ""in vitro"" experience.","1987"
"340","3304736","1987 Jan","Parreira A","Catovsky D","Clinical and experimental immunology","Immunological reconstitution after bone marrow transplant with Campath-1 treated bone marrow.","1987"
"341","2878268","1986 Dec 13","Pollard CM","Helenglass G","Lancet (London, England)","Leukaemic relapse after Campath 1 treated bone marrow transplantation for leukaemia.","1986"
"342","2878219","1986 Dec 6","Pollard CM","Helenglass G","Lancet (London, England)","Leukaemic relapse following Campath 1 treated bone marrow transplantation for leukaemia.","1986"
"343","3492041","1986 Nov 29","Irlé C","Jeannet M","Schweizerische medizinische Wochenschrift","[Effect of T-cell depletion of the graft on graft survival and graft vs host disease].","1986"
"344","3543275","1986 Nov","Dilly SA","Psalti IS","The Journal of pathology","The cellular composition of human lymph nodes after allogenic bone marrow transplantation: an immunohistological study.","1986"
"345","3539172","1986 Nov","Heit W","Heimpel H","British journal of haematology","Ex vivo T-cell depletion with the monoclonal antibody Campath-1 plus human complement effectively prevents acute graft-versus-host disease in allogeneic bone marrow transplantation.","1986"
"346","3538379","1986 Oct 25","Chapuis B","Pipard G","Schweizerische medizinische Wochenschrift","[Transplantation of allogeneic bone marrow treated in vitro with Campath-1 monoclonal antibody].","1986"
"347","3096200","1986 Oct","Weiss L","Slavin S","Applied biochemistry and biotechnology","Depletion of human lymphocytes from peripheral blood and bone marrow by affinity ligands conjugated to agarose-polyacrolein microsphere beads.","1986"
"348","3531347","1986 Sep 27","Wilson AB","Coombs RR","Journal of immunological methods","Direct antibody rosette-forming reactions using monoclonal markers of lymphocyte subpopulations. Methodology and applications illustrated by investigations with rat pan-T antibodies of the CAMPATH series.","1986"
"349","2867383","1986 Jan 18","Poynton CH","Barrett AJ","Lancet (London, England)","Leukaemic relapse associated with phenotypic change after CAMPATH-1 purged autologous bone marrow transplantation.","1986"
"350","3909387","1985 Oct 26","Chapuis B","Jeannet M","Schweizerische medizinische Wochenschrift","[Transplantation of allogeneic bone marrow treated in vitro with Campath-1 monoclonal antibody].","1985"
"351","3909385","1985 Oct 26","Irlé C","Jeannet M","Schweizerische medizinische Wochenschrift","[Quantitative determination of human bone marrow T cells following in vitro depletion by Campath-1 monoclonal antibody].","1985"
"352","3890929","1985 May","Hale G","Chan LC","British journal of haematology","Reactivity of rat monoclonal antibody CAMPATH-1 with human leukaemia cells and its possible application for autologous bone marrow transplantation.","1985"
"353","3901694","1985","Waldmann H","Tighe H","Advances in experimental medicine and biology","Rat monoclonal antibodies for bone marrow transplantation--the CAMPATH series.","1985"
"354","3901693","1985","Slavin S","Galili D","Advances in experimental medicine and biology","Elimination of graft versus host disease in matched allogeneic leukemic transplant recipients using CAMPATH-1.","1985"
"355","6147548","1984 Sep 1","Waldmann H","Brautbar C","Lancet (London, England)","Elimination of graft-versus-host disease by in-vitro depletion of alloreactive lymphocytes with a monoclonal rat anti-human lymphocyte antibody (CAMPATH-1).","1984"
"356","13837954","1959 Oct","THOMAS ED","FERREBEE JW","The Journal of clinical investigation","Supralethal whole body irradiation and isologous marrow transplantation in man.","1959"
"357","13099277","1953 Oct 3","BILLINGHAM RE","MEDAWAR PB","Nature","Actively acquired tolerance of foreign cells.","1953"
"358","4894426","1969 Aug 2","Calne RY","Davies DA","Nature","Induction of immunological tolerance by porcine liver allografts.","1969"
"359","4325096","1971 May","Armstrong D","Blevins AH","The Medical clinics of North America","Infectious complications of neoplastic disease.","1971"
"360","1139039","1975 Aug","Rai KR","Pasternack BS","Blood","Clinical staging of chronic lymphocytic leukemia.","1975"
"361","1172191","1975 Aug 7","Köhler G","Milstein C","Nature","Continuous cultures of fused cells secreting antibody of predefined specificity.","1975"
"362","766892","1976 Feb","Woodruff MF","Jenkins AM","The British journal of surgery","Long survival after renal transplantation in man.","1976"
"363","322854","1977 May","Kaplan MH","Armstrong D","Cancer","Cryptococcosis in a cancer hospital: clinical and pathological correlates in forty-six patients.","1977"
"364","350045","1978 Jun","Kauffman CA","Brooks GF","The American journal of medicine","Histoplasmosis in immunosuppressed patients.","1978"
"365","82836","1978 Dec 23-30","Calne RY","Rolles K","Lancet (London, England)","Cyclosporin A in patients receiving renal allografts from cadaver donors.","1978"
"366","505093","1979 Nov","Fulkerson W","Davis BW","Southern medical journal","Opportunistic infections in chronic lymphocytic leukemia.","1979"
"367","6157721","1980 Sep","Platsoucas CD","Gupta S","Journal of immunology (Baltimore, Md. : 1950)","Defective spontaneous and antibody-dependent cytotoxicity mediated by E-rosette-positive and E-rosette-negative cells in untreated patients with chronic lymphocytic leukemia: augmentation by in vitro treatment with interferon.","1980"
"368","7427932","1980 Sep","Nadler LM","Schlossman SF","Cancer research","Serotherapy of a patient with a monoclonal antibody directed against a human lymphoma-associated antigen.","1980"
"369","6969092","1980 Dec","Foa R","Galton DA","British journal of haematology","Reduced T-colony forming capacity by T-lymphocytes from B-chronic lymphocyte leukaemia.","1980"
"370","7237385","1981 Jul 1","Binet JL","Gremy F","Cancer","A new prognostic classification of chronic lymphocytic leukemia derived from a multivariate survival analysis.","1981"
"371","6173751","1982 Mar 4","Miller RA","Levy R","The New England journal of medicine","Treatment of B-cell lymphoma with monoclonal anti-idiotype antibody.","1982"
"372","6482933","1984 Nov 1","Foon KA","Zeffren J","The New England journal of medicine","Treatment of advanced non-Hodgkin's lymphoma with recombinant leukocyte A interferon.","1984"
"373","6377608","1984 Jul","Campos H","Crosnier J","Transplantation","Azathioprine withdrawal in renal transplant recipients. A long-term follow-up.","1984"
"374","6609729","1984 Jun","Anderson KC","Nadler LM","Blood","Expression of human B cell-associated antigens on leukemias and lymphomas: a model of human B cell differentiation.","1984"
"375","3871353","1985 Feb","Schroff RW","Morgan AC Jr","Cancer research","Human anti-murine immunoglobulin responses in patients receiving monoclonal antibody therapy.","1985"
"376","3529524","1986 Sep","Cobbold S","Waldmann H","Transplantation","Monoclonal antibodies for the prevention of graft-versus-host disease and marrow graft rejection. The depletion of T cell subsets in vitro and in vivo.","1986"
"377","3296349","1987 Jun","Kernan NA","O'Reilly RJ","Transplantation","Graft rejection in recipients of T-cell-depleted HLA-nonidentical marrow transplants for leukemia. Identification of host-derived antidonor allocytotoxic T lymphocytes.","1987"
"378","3317855","1987 Oct","Chapel HM","Bunch C","Seminars in hematology","Mechanisms of infection in chronic lymphocytic leukemia.","1987"
"379","2901280","1988 Sep","Piro LD","Carson DA","Blood","2-Chlorodeoxyadenosine: an effective new agent for the treatment of chronic lymphocytic leukemia.","1988"
"380","2901668","1988 Oct 6","","","The New England journal of medicine","Intravenous immunoglobulin for the prevention of infection in chronic lymphocytic leukemia. A randomized, controlled clinical trial. Cooperative Group for the Study of Immunoglobulin in Chronic Lymphocytic Leukemia.","1988"
"381","3050711","1988 Sep","Barrett AP","Barrett AP","Oral surgery, oral medicine, and oral pathology","Chronic indolent orofacial herpes simplex virus infection in chronic leukemia: a report of three cases.","1988"
"382","2833957","1988 May","Shapiro RS","Burke B","Blood","Epstein-Barr virus associated B cell lymphoproliferative disorders following bone marrow transplantation.","1988"
"383","2667754","1989 Sep 1","Press OW","Martin PJ","Cancer research","Endocytosis and degradation of monoclonal antibodies targeting human B-cell malignancies.","1989"
"384","2784491","1989 Apr","Dillman RO","McIntyre OR","Journal of clinical oncology : official journal of the American Society of Clinical Oncology","Pentostatin in chronic lymphocytic leukemia: a phase II trial of Cancer and Leukemia group B.","1989"
"385","2297567","1990 Feb 1","Horowitz MM","Speck B","Blood","Graft-versus-leukemia reactions after bone marrow transplantation.","1990"
"386","2099402","1990","Travade P","Travade P","Nouvelle revue francaise d'hematologie","The experience of the French Cooperative Group in the treatment of CLL.","1990"
"387","1714949","1991 Sep","Puccio CA","Arlin ZA","Journal of clinical oncology : official journal of the American Society of Clinical Oncology","A loading dose/continuous infusion schedule of fludarabine phosphate in chronic lymphocytic leukemia.","1991"
"388","1904989","1991 Jul 11","Weeks JC","Weinstein MC","The New England journal of medicine","Cost effectiveness of prophylactic intravenous immune globulin in chronic lymphocytic leukemia.","1991"
"389","2024863","1991 Jun 1","Sayegh MH","Tilney NL","Annals of internal medicine","Immunologic tolerance to renal allografts after bone marrow transplants from the same donors.","1991"
"390","2070147","1991 May","Anasetti C","Stewart P","Bone marrow transplantation","Prophylaxis of graft-versus-host disease by administration of the murine anti-IL-2 receptor antibody 2A3.","1991"
"391","1715244","1991 Aug 23","Liu J","Schreiber SL","Cell","Calcineurin is a common target of cyclophilin-cyclosporin A and FKBP-FK506 complexes.","1991"
"392","1742486","1991 Dec 15","Matutes E","Catovsky D","Blood","Clinical and laboratory features of 78 cases of T-prolymphocytic leukemia.","1991"
"393","1370636","1992 Feb 1","Grossbard ML","Blättler WA","Blood","Serotherapy of B-cell neoplasms with anti-B4-blocked ricin: a phase I trial of daily bolus infusion.","1992"
