"","id","pubdate","firstauthor","lastauthor","source","title","year"
"394","1354425","1992 Sep 15","Anaissie E","Keating M","Annals of internal medicine","Listeriosis in patients with chronic lymphocytic leukemia who were treated with fludarabine and prednisone.","1992"
"395","1498329","1992 Aug 15","Grossbard ML","Nadler LM","Blood","Monoclonal antibody-based therapies of leukemia and lymphoma.","1992"
"396","1644158","1992 May","Itälä M","Remes K","European journal of haematology","Infections and serum IgG levels in patients with chronic lymphocytic leukemia.","1992"
"397","1406793","1992 Oct 22","Kwak LW","Levy R","The New England journal of medicine","Induction of immune responses in patients with B-cell lymphoma against the surface-immunoglobulin idiotype expressed by their tumors.","1992"
"398","8099991","1993 Jun 26","Lockwood CM","Waldmann H","Lancet (London, England)","Long-term remission of intractable systemic vasculitis with monoclonal antibody therapy.","1993"
"399","8499626","1993 Jun 1","Keating MJ","Freireich EJ","Blood","Long-term follow-up of patients with chronic lymphocytic leukemia treated with fludarabine as a single agent.","1993"
"400","7687326","1993 Aug 12","Kaminski MS","Butchko GM","The New England journal of medicine","Radioimmunotherapy of B-cell lymphoma with [131I]anti-B1 (anti-CD20) antibody.","1993"
"401","7686506","1993 May","Wijermans PW","Haak HL","European journal of haematology","Severe immunodeficiency in patients treated with fludarabine monophosphate.","1993"
"402","8353071","1993 May","Bergmann L","Hoelzer D","Annals of oncology : official journal of the European Society for Medical Oncology","Immunosuppressive effects and clinical response of fludarabine in refractory chronic lymphocytic leukemia.","1993"
"403","8400226","1993 Sep 15","O'Brien S","Keating M","Blood","Results of fludarabine and prednisone therapy in 264 patients with chronic lymphocytic leukemia with multivariate analysis-derived prognostic model for response to treatment.","1993"
"404","8211209","1993 Oct","Horning SJ","Horning SJ","Seminars in oncology","Natural history of and therapy for the indolent non-Hodgkin's lymphomas.","1993"
"405","8228826","1993 Nov 1","Lin H","Turka LA","The Journal of experimental medicine","Long-term acceptance of major histocompatibility complex mismatched cardiac allografts induced by CTLA4Ig plus donor-specific transfusion.","1993"
"406","8450856","1993 Apr 8","Armitage JO","Armitage JO","The New England journal of medicine","Treatment of non-Hodgkin's lymphoma.","1993"
"407","7680398","1993 Mar","Elias L","Appelbaum FR","Leukemia","A phase I trial of combination fludarabine monophosphate and chlorambucil in chronic lymphocytic leukemia: a Southwest Oncology Group study.","1993"
"408","7692295","1993 Oct 21","Press OW","Porter B","The New England journal of medicine","Radiolabeled-antibody therapy of B-cell lymphoma with autologous bone marrow support.","1993"
"409","8235691","1993 Oct","","","Seminars in oncology","Comparison of fludarabine, cyclophosphamide/doxorubicin/prednisone, and cyclophosphamide/doxorubicin/vincristine/prednisone in advanced forms of chronic lymphocytic leukemia: preliminary results of a controlled clinical trial. The French Cooperative Group on Chronic Lymphocytic Leukemia.","1993"
"410","8485477","1993 Apr","Belanger C","Reiffers J","Bone marrow transplantation","Use of an anti-interleukin-2 receptor monoclonal antibody for GVHD prophylaxis in unrelated donor BMT.","1993"
"411","8057664","1994 Aug","Weiss M","Kempin S","Leukemia","Concomitant administration of chlorambucil limits dose intensity of fludarabine in previously treated patients with chronic lymphocytic leukemia.","1994"
"412","7506951","1994 Jan 15","Reff ME","Anderson DR","Blood","Depletion of B cells in vivo by a chimeric mouse human monoclonal antibody to CD20.","1994"
"413","7524522","1994 Sep","Tedder TF","Engel P","Immunology today","CD20: a regulator of cell-cycle progression of B lymphocytes.","1994"
"414","7989933","1994 Dec","Mercieca J","Catovsky D","Journal of clinical oncology : official journal of the American Society of Clinical Oncology","The role of pentostatin in the treatment of T-cell malignancies: analysis of response rate in 145 patients according to disease subtype.","1994"
"415","8197602","1994 May 27","Calne RY","Davies HS","Transplantation","Tolerance of porcine renal allografts induced by donor spleen cells and seven days' treatment with cyclosporine.","1994"
"416","7525186","1994","Juliusson G","Juliusson G","Drugs","Immunological and genetic abnormalities in chronic lymphocytic leukaemia. Impact of the purine analogues.","1994"
"417","8069190","1994 May","","","Leukemia &amp; lymphoma","Is the CHOP regimen a good treatment for advanced CLL? Results from two randomized clinical trials. French Cooperative Group on Chronic Lymphocytic Leukemia.","1994"
"418","8049645","1994 Apr","Molica S","Molica S","Leukemia &amp; lymphoma","Infections in chronic lymphocytic leukemia: risk factors, and impact on survival, and treatment.","1994"
"419","8120556","1994 Mar","McLaughlin P","Keating M","Journal of clinical oncology : official journal of the American Society of Clinical Oncology","Phase I study of the combination of fludarabine, mitoxantrone, and dexamethasone in low-grade lymphoma.","1994"
"420","7809937","1994 Dec 27","Helg C","Leski M","Transplantation","Renal transplantation without immunosuppression in a host with tolerance induced by allogeneic bone marrow transplantation.","1994"
"421","7540098","1994 Dec","Olweus J","Terstappen LW","ImmunoMethods","Expression of cell surface markers during differentiation of CD34+, CD38-/lo fetal and adult bone marrow cells.","1994"
"422","8587293","1995 Dec","Danovitch GM","Danovitch GM","Kidney international. Supplement","Mycophenolate mofetil in renal transplantation: results from the U.S. randomized trials.","1995"
"423","7879054","1995 Feb","Dutartre P","Derrepas P","Transplantation proceedings","LF 08-0299 induces tolerance after short-term treatment in a fully major histocompatibility mismatched rat cardiac allograft model.","1995"
"424","7579468","1995 Nov 1","Spencer A","Goldman JM","Blood","Bone marrow transplantation for chronic myeloid leukemia with volunteer unrelated donors using ex vivo or in vivo T-cell depletion: major prognostic impact of HLA class I identity between donor and recipient.","1995"
"425","8588237","1995 Dec","Sehgal SN","Sehgal SN","Therapeutic drug monitoring","Rapamune (Sirolimus, rapamycin): an overview and mechanism of action.","1995"
"426","7584950","1995 Jan","Snyder SH","Sabatini DM","Nature medicine","Immunophilins and the nervous system.","1995"
"427","7536798","1995 May 1","Sayegh MH","Turka LA","The Journal of experimental medicine","CD28-B7 blockade after alloantigenic challenge in vivo inhibits Th1 cytokines but spares Th2.","1995"
"428","7771465","1995 Jun","Byrd JC","Diehl LF","American journal of hematology","Opportunistic pulmonary infections with fludarabine in previously treated patients with low-grade lymphoid malignancies: a role for Pneumocystis carinii pneumonia prophylaxis.","1995"
"429","7596181","1995 Jun","Robertson LE","Keating MJ","Leukemia","Fludarabine plus doxorubicin in previously treated chronic lymphocytic leukemia.","1995"
"430","7723546","1995 May 6","Blaise D","Maraninchi D","Lancet (London, England)","Impairment of leukaemia-free survival by addition of interleukin-2-receptor antibody to standard graft-versus-host prophylaxis.","1995"
"431","7781137","1995","Tamura K","Suzuoki Y","Cancer chemotherapy and pharmacology","Phase I study of NKT-01.","1995"
"432","8528057","1995 Aug","Fenchel K","Hoelzer D","Leukemia &amp; lymphoma","Clinical experience with fludarabine and its immunosuppressive effects in pretreated chronic lymphocytic leukemias and low-grade lymphomas.","1995"
"433","7666104","1995 Sep","Cheson BD","Cheson BD","Journal of clinical oncology : official journal of the American Society of Clinical Oncology","Infectious and immunosuppressive complications of purine analog therapy.","1995"
"434","9552353","1995","Wiederrecht GJ","Abraham RT","Progress in cell cycle research","Mechanism of action of rapamycin: new insights into the regulation of G1-phase progression in eukaryotic cells.","1995"
"435","8751471","1996 Sep","Schlesinger M","Lugassy G","Leukemia","The complement system is defective in chronic lymphatic leukemia patients and in their healthy relatives.","1996"
"436","8962411","1996 Dec","Groth CG","Groth CG","Transplantation proceedings","The European experience with mycophenolate mofetil. European Mycophenolate Mofetil Cooperative Study Group.","1996"
"437","8962412","1996 Dec","Tomlanovich SJ","Tomlanovich SJ","Transplantation proceedings","Rescue therapy with mycophenolate mofetil. Mycophenolate Mofetil Renal Refractory Rejection Study Group.","1996"
"438","8977262","1996 Dec 15","Elsner J","Kapp A","Blood","Surface and mRNA expression of the CD52 antigen by human eosinophils but not by neutrophils.","1996"
"439","8630428","1996 Mar 15","Lucas KG","O'Reilly RJ","Blood","The development of cellular immunity to Epstein-Barr virus after allogeneic bone marrow transplantation.","1996"
"440","8971469","1996 Nov","von Mehren M","Weiner LM","Current opinion in oncology","Monoclonal antibody-based therapy.","1996"
"441","9172812","1996 May","Montserrat E","Bosch F","Leukemia &amp; lymphoma","Fludarabine in resistant or relapsing B-cell chronic lymphocytic leukemia: the Spanish Group experience.","1996"
"442","8546551","1996 Jan 22","Ioannidis JP","Sacks HS","Archives of internal medicine","A meta-analysis of the relative efficacy and toxicity of Pneumocystis carinii prophylactic regimens.","1996"
"443","9238677","1996 Mar","Kirchhoff C","Hale G","Molecular human reproduction","Cell-to-cell transfer of glycosylphosphatidylinositol-anchored membrane proteins during sperm maturation.","1996"
"444","8641639","1996 Mar-Apr","Molica S","Rotoli B","Haematologica","Prophylaxis against infections with low-dose intravenous immunoglobulins (IVIG) in chronic lymphocytic leukemia. Results of a crossover study.","1996"
"445","8970605","1996 Dec 15","Andoins C","Dutartre P","Transplantation","Tolerance in a rat cardiac allograft model after short-term treatment with LF 08-0299. Absence of clonal deletion and evidence of CD4+ suppressor cells.","1996"
"446","8918281","1996 Nov 16","Lipsky JJ","Lipsky JJ","Lancet (London, England)","Mycophenolate mofetil.","1996"
"447","9355822","1997 Oct 27","van Leeuwen L","Atkinson K","Transplantation","Administration of mycophenolate mofetil in a murine model of acute graft-versus-host disease after bone marrow transplantation.","1997"
"448","9324281","1997 Oct","O'Brien S","Keating MJ","Leukemia","Fludarabine and granulocyte colony-stimulating factor (G-CSF) in patients with chronic lymphocytic leukemia.","1997"
"449","9414645","1997 Nov","Zaja F","Baccarani M","European journal of haematology","Combined therapy with Fludarabine and cyclophosphamide in relapsed/resistant patients with B-cell chronic lymphocytic leukaemia and non-Hodgkin's lymphomas.","1997"
"450","9351970","1997 Nov","Li L","Yang LY","Molecular pharmacology","Fludarabine-mediated repair inhibition of cisplatin-induced DNA lesions in human chronic myelogenous leukemia-blast crisis K562 cells: induction of synergistic cytotoxicity independent of reversal of apoptosis resistance.","1997"
"451","10851464","1997 Jun","Demidem A","Bonavida B","Cancer biotherapy &amp; radiopharmaceuticals","Chimeric anti-CD20 (IDEC-C2B8) monoclonal antibody sensitizes a B cell lymphoma cell line to cell killing by cytotoxic drugs.","1997"
"452","9250791","1997 Jun","Mehta J","Catovsky D","Leukemia &amp; lymphoma","Antimicrobial prophylaxis to prevent opportunistic infections in patients with chronic lymphocytic leukemia after allogeneic blood or marrow transplantation.","1997"
"453","9177426","1997 Jun","Rozman C","Montserrat E","Leukemia","Chronic lymphocytic leukemia: a changing natural history?","1997"
"454","9145041","1997 May","Nagano H","Tilney NL","The American journal of the medical sciences","Chronic allograft failure: the clinical problem.","1997"
"455","9192777","1997 Jun 15","Giralt S","Champlin R","Blood","Engraftment of allogeneic hematopoietic progenitor cells with purine analog-containing chemotherapy: harnessing graft-versus-leukemia without myeloablative therapy.","1997"
"456","9178837","1997 Apr","Südhoff T","Schneider W","Leukemia","Prophylactic strategies to meet infectious complications in fludarabine-treated CLL.","1997"
"457","9209669","1997 Apr","Zinzani PL","Tura S","Annals of oncology : official journal of the European Society for Medical Oncology","Fludarabine-mitoxantrone combination-containing regimen in recurrent low-grade non-Hodgkin's lymphoma.","1997"
"458","9122943","1997 Feb-Mar","Calne SR","Calne SR","Transplantation proceedings","Progress toward tolerance and xenografting.","1997"
"459","9108450","1997 Apr 15","Li L","Yang LY","Cancer research","Fludarabine triphosphate inhibits nucleotide excision repair of cisplatin-induced DNA adducts in vitro.","1997"
"460","9048207","1997 Feb","Junghans RP","Junghans RP","Immunologic research","Finally! The Brambell receptor (FcRB). Mediator of transmission of immunity and protection from catabolism for IgG.","1997"
"461","9053466","1997 Feb","Sorensen JM","Cheson BD","Journal of clinical oncology : official journal of the American Society of Clinical Oncology","Treatment of refractory chronic lymphocytic leukemia with fludarabine phosphate via the group C protocol mechanism of the National Cancer Institute: five-year follow-up report.","1997"
"462","9471060","1997 Nov","Juliusson G","Juliusson G","Hematology and cell therapy","Complications in the treatment of CLL with purine analogues.","1997"
"463","9402750","1997 Sep-Oct","Zinzani PL","Zinzani PL","Haematologica","Idarubicin in low-grade non-Hodgkin's lymphomas.","1997"
"464","9760161","1998 Jul-Aug","Jensen M","Engert A","Annals of hematology","Rapid tumor lysis in a patient with B-cell chronic lymphocytic leukemia and lymphocytosis treated with an anti-CD20 monoclonal antibody (IDEC-C2B8, rituximab).","1998"
"465","9779698","1998 Oct","DeNardo GL","Lewis JP","Journal of clinical oncology : official journal of the American Society of Clinical Oncology","Maximum-tolerated dose, toxicity, and efficacy of (131)I-Lym-1 antibody for fractionated radioimmunotherapy of non-Hodgkin's lymphoma.","1998"
"466","9779701","1998 Oct","Liu SY","Press OW","Journal of clinical oncology : official journal of the American Society of Clinical Oncology","Follow-up of relapsed B-cell lymphoma patients treated with iodine-131-labeled anti-CD20 antibody and autologous stem-cell rescue.","1998"
"467","9708202","1998 May","Ginaldi L","Catovsky D","Journal of clinical pathology","Levels of expression of CD19 and CD20 in chronic B cell leukaemias.","1998"
"468","9685176","1998 Jul","O'Brien S","O'Brien S","Seminars in hematology","Clinical challenges in chronic lymphocytic leukemia.","1998"
"469","9685175","1998 Jul","Cheson BD","Cheson BD","Seminars in hematology","Therapy for previously untreated chronic lymphocytic leukemia: a reevaluation.","1998"
"470","9704734","1998 Aug","Khouri IF","Champlin R","Journal of clinical oncology : official journal of the American Society of Clinical Oncology","Transplant-lite: induction of graft-versus-malignancy using fludarabine-based nonablative chemotherapy and allogeneic blood progenitor-cell transplantation as treatment for lymphoid malignancies.","1998"
"471","9482530","1998 Feb","Diehl LF","Ketchum LH","Seminars in oncology","Autoimmune disease and chronic lymphocytic leukemia: autoimmune hemolytic anemia, pure red cell aplasia, and autoimmune thrombocytopenia.","1998"
"472","9482531","1998 Feb","Morrison VA","Morrison VA","Seminars in oncology","The infectious complications of chronic lymphocytic leukemia.","1998"
"473","9446633","1998 Feb 1","Slavin S","Or R","Blood","Nonmyeloablative stem cell transplantation and cell therapy as an alternative to conventional bone marrow transplantation with lethal cytoreduction for the treatment of malignant and nonmalignant hematologic diseases.","1998"
"474","9516160","1998 Apr 1","Yu C","Storb R","Blood","Synergism between mycophenolate mofetil and cyclosporine in preventing graft-versus-host disease among lethally irradiated dogs given DLA-nonidentical unrelated marrow grafts.","1998"
"475","9721431","1998 Jul","Sehgal SN","Sehgal SN","Clinical biochemistry","Rapamune (RAPA, rapamycin, sirolimus): mechanism of action immunosuppressive effect results from blockade of signal transduction and inhibition of cell cycle progression.","1998"
"476","9691083","1998 Aug 1","Blazar BR","Vallera DA","The Journal of clinical investigation","CD4(+) T cells tolerized ex vivo to host alloantigen by anti-CD40 ligand (CD40L:CD154) antibody lose their graft-versus-host disease lethality capacity but retain nominal antigen responses.","1998"
"477","9746768","1998 Oct 1","Ratanatharathorn V","Wingard JR","Blood","Phase III study comparing methotrexate and tacrolimus (prograf, FK506) with methotrexate and cyclosporine for graft-versus-host disease prophylaxis after HLA-identical sibling bone marrow transplantation.","1998"
"478","9758577","1998 Oct 1","Anaissie EJ","Keating MJ","Annals of internal medicine","Infections in patients with chronic lymphocytic leukemia treated with fludarabine.","1998"
"479","9694951","1998 Aug","Gobburu JV","Jusko WJ","The Journal of pharmacology and experimental therapeutics","Pharmacokinetics/dynamics of 5c8, a monoclonal antibody to CD154 (CD40 ligand) suppression of an immune response in monkeys.","1998"
"480","10235069","1998 Sep","Emmanouilides C","Kunkel L","Hematological oncology","Treatment of indolent lymphoma with fludarabine/mitoxantrone combination: a phase II trial.","1998"
"481","9573030","1998 May 15","Stoppa-Lyonnet D","Stern MH","Blood","Inactivation of the ATM gene in T-cell prolymphocytic leukemias.","1998"
"482","9603161","1998 May 15","Contreras JL","Thomas JM","Transplantation","Peritransplant tolerance induction with anti-CD3-immunotoxin: a matter of proinflammatory cytokine control.","1998"
"483","9694704","1998 Aug 15","Keating MJ","Kantarjian H","Blood","Long-term follow-up of patients with chronic lymphocytic leukemia (CLL) receiving fludarabine regimens as initial therapy.","1998"
"484","9694706","1998 Aug 15","Davis TA","Levy R","Blood","Anti-idiotype antibodies can induce long-term complete remissions in non-Hodgkin's lymphoma without eradicating the malignant clone.","1998"
"485","9845514","1998 Dec 15","Armitage JO","Armitage JO","Blood","Emerging applications of recombinant human granulocyte-macrophage colony-stimulating factor.","1998"
"486","9808489","1998 Oct 27","Kahan BD","Van Buren CT","Transplantation","Immunosuppressive effects and safety of a sirolimus/cyclosporine combination regimen for renal transplantation.","1998"
"487","10541378","1999 Oct","Juweid ME","Goldenberg DM","Clinical cancer research : an official journal of the American Association for Cancer Research","Pharmacokinetics, dosimetry, and initial therapeutic results with 131I- and (111)In-/90Y-labeled humanized LL2 anti-CD22 monoclonal antibody in patients with relapsed, refractory non-Hodgkin's lymphoma.","1999"
"488","10551552","1999","Kalil N","Cheson BD","The oncologist","Chronic lymphocytic leukemia.","1999"
"489","10556958","1999 Nov","Schey S","Jones R","Bone marrow transplantation","Dose intensification and molecular responses in patients with chronic lymphocytic leukaemia: a phase II single centre study.","1999"
"490","10561021","1999 Oct","Maloney DG","Maloney DG","Seminars in oncology","Preclinical and phase I and II trials of rituximab.","1999"
"491","10589082","1999 Dec","Yang H","Figlin RA","American journal of hematology","Tumor lysis syndrome occurring after the administration of rituximab in lymphoproliferative disorders: high-grade non-Hodgkin's lymphoma and chronic lymphocytic leukemia.","1999"
"492","10561026","1999 Oct","Buckstein R","Berinstein NL","Seminars in oncology","Stem cell function and engraftment is not affected by ""in vivo purging"" with rituximab for autologous stem cell treatment for patients with low-grade non-Hodgkin's lymphoma.","1999"
"493","10577851","1999 Dec","Witzig TE","Grillo-López AJ","Journal of clinical oncology : official journal of the American Society of Clinical Oncology","Phase I/II trial of IDEC-Y2B8 radioimmunotherapy for treatment of relapsed or refractory CD20(+) B-cell non-Hodgkin's lymphoma.","1999"
"494","10430977","1999 Aug","","","American journal of kidney diseases : the official journal of the National Kidney Foundation","Mycophenolate mofetil in cadaveric renal transplantation. US Renal Transplant Mycophenolate Mofetil Study Group.","1999"
"495","10442187","1999 Jun","Piro LD","Jain V","Annals of oncology : official journal of the European Society for Medical Oncology","Extended Rituximab (anti-CD20 monoclonal antibody) therapy for relapsed or refractory low-grade or follicular non-Hodgkin's lymphoma.","1999"
"496","10515887","1999 Oct 15","Bellosillo B","Gil J","Blood","In vitro evaluation of fludarabine in combination with cyclophosphamide and/or mitoxantrone in B-cell chronic lymphocytic leukemia.","1999"
"497","10482936","1999 Sep","Mookerjee B","Vogelsang G","Bone marrow transplantation","Salvage therapy for refractory chronic graft-versus-host disease with mycophenolate mofetil and tacrolimus.","1999"
"498","10439375","1999 Jul","Aittoniemi J","Vilpo J","Leukemia &amp; lymphoma","Opsonising immunoglobulins and mannan-binding lectin in chronic lymphocytic leukemia.","1999"
"499","10512062","1999 Oct","Berard JL","Tsunoda SM","Pharmacotherapy","A review of interleukin-2 receptor antagonists in solid organ transplantation.","1999"
"500","10190945","1999 Apr","Stelitano C","Brugiatelli M","Haematologica","Fludarabine treatment in B-cell chronic lymphocytic leukemia: response, toxicity and survival analysis in 47 cases.","1999"
"501","10516680","1999 Oct","Przepiorka D","Champlin R","Bone marrow transplantation","Tacrolimus and minidose methotrexate for prevention of acute graft-versus-host disease after HLA-mismatched marrow or blood stem cell transplantation.","1999"
"502","10543369","1999 Aug","Morra E","Montillo M","Hematology and cell therapy","Infectious complications in chronic lymphocytic leukaemia.","1999"
"503","10458259","1999 Jan","Caligaris-Cappio F","Hamblin TJ","Journal of clinical oncology : official journal of the American Society of Clinical Oncology","B-cell chronic lymphocytic leukemia: a bird of a different feather.","1999"
"504","10408631","1999 May","Komesli S","Dutartre P","International journal of immunopharmacology","Analysis of in vivo immunosuppressive and in vitro interaction with constitutive heat shock protein 70 activity of LF08-0299 (Tresperimus) and analogues.","1999"
"505","10371508","1999 Jun","Kirk AD","Harlan DM","Nature medicine","Treatment with humanized monoclonal antibody against CD154 prevents acute renal allograft rejection in nonhuman primates.","1999"
"506","10371494","1999 Jun","Matzinger P","Matzinger P","Nature medicine","Graft tolerance: a duel of two signals.","1999"
"507","10354146","1999 Jun","Visani G","Tura S","British journal of haematology","Fludarabine-containing regimens severely impair peripheral blood stem cells mobilization and collection in acute myeloid leukaemia patients.","1999"
"508","10188761","1999 Feb","Onrust SV","Wiseman LR","Drugs","Basiliximab.","1999"
"509","10561225","1999 Jun","Davis TA","Levy R","Journal of clinical oncology : official journal of the American Society of Clinical Oncology","Single-agent monoclonal antibody efficacy in bulky non-Hodgkin's lymphoma: results of a phase II trial of rituximab.","1999"
"510","9973447","1999 Feb 1","Weinberg AD","Whitham RH","Journal of immunology (Baltimore, Md. : 1950)","Blocking OX-40/OX-40 ligand interaction in vitro and in vivo leads to decreased T cell function and amelioration of experimental allergic encephalomyelitis.","1999"
"511","10498591","1999 Oct 1","Winkler U","Engert A","Blood","Cytokine-release syndrome in patients with B-cell chronic lymphocytic leukemia and high lymphocyte counts after treatment with an anti-CD20 monoclonal antibody (rituximab, IDEC-C2B8).","1999"
"512","10613450","1999 Dec","Giles FJ","Keating MJ","Leukemia &amp; lymphoma","Sequential cis-platinum and fludarabine with or without arabinosyl cytosine in patients failing prior fludarabine therapy for chronic lymphocytic leukemia: a phase II study.","1999"
"513","10855789","1999","Dillman RO","Dillman RO","Cancer metastasis reviews","Infusion reactions associated with the therapeutic use of monoclonal antibodies in the treatment of malignancy.","1999"
"514","10352162","1999 Jun 3","Guinan EC","Gribben JG","The New England journal of medicine","Transplantation of anergic histoincompatible bone marrow allografts.","1999"
"515","10352169","1999 Jun 3","Schwartz RS","Schwartz RS","The New England journal of medicine","The new immunology--the end of immunosuppressive drug therapy?","1999"
"516","10221486","1999 Apr 15","Brennan DC","Singer GG","Transplantation","A randomized, double-blinded comparison of Thymoglobulin versus Atgam for induction immunosuppressive therapy in adult renal transplant recipients.","1999"
"517","10573065","1999 Nov 15","Kovarik JM","Hall ML","Transplantation","Population pharmacokinetics and exposure-response relationships for basiliximab in kidney transplantation. The U.S. Simulect Renal Transplant Study Group.","1999"
"518","10411505","1999 Jul 16","Shlomchik WD","Emerson SG","Science (New York, N.Y.)","Prevention of graft versus host disease by inactivation of host antigen-presenting cells.","1999"
